pagSeccion;titulo;href
https://www.pagina12.com.ar/secciones/sociedad?page=183;Un policía mató a dos jóvenes que intentaron asaltarlo con un arma de utilería;https://www.pagina12.com.ar/343576-un-policia-mato-a-dos-jovenes-que-intentaron-asaltarlo-con-u
https://www.pagina12.com.ar/secciones/sociedad?page=183;Un informe de la ONU resalta las políticas públicas argentinas en cuestiones de género;https://www.pagina12.com.ar/343578-un-informe-de-la-onu-resalta-las-politicas-publicas-argentin
https://www.pagina12.com.ar/secciones/sociedad?page=183;Llamada evangélica;https://www.pagina12.com.ar/343688-llamada-evangelica
https://www.pagina12.com.ar/secciones/sociedad?page=183;Costa Atlántica: murió otra de las jóvenes que habían sufrido un trágico choque en noviembre;https://www.pagina12.com.ar/343684-costa-atlantica-murio-otra-de-las-jovenes-que-habian-sufrido
https://www.pagina12.com.ar/secciones/sociedad?page=183;Confirman un nuevo vuelo a Rusia para buscar más dosis de Sputnik V;https://www.pagina12.com.ar/343635-confirman-un-nuevo-vuelo-a-rusia-para-buscar-mas-dosis-de-sp
https://www.pagina12.com.ar/secciones/sociedad?page=183;Cómo preparar un rico locro en tres pasos;https://www.pagina12.com.ar/343614-como-preparar-un-rico-locro-en-tres-pasos
https://www.pagina12.com.ar/secciones/sociedad?page=183;Qué es el hongo negro, la rara enfermedad que afecta a pacientes con Covid en India;https://www.pagina12.com.ar/343596-que-es-el-hongo-negro-la-rara-enfermedad-que-afecta-a-pacien
https://www.pagina12.com.ar/secciones/sociedad?page=183;¿El planeta necesita que lo salven?  ;https://www.pagina12.com.ar/343592-el-planeta-necesita-que-lo-salven
https://www.pagina12.com.ar/secciones/sociedad?page=183;Llegan al país casi un millón y medio de vacunas contra el coronavirus;https://www.pagina12.com.ar/343584-llegan-al-pais-casi-un-millon-y-medio-de-vacunas-contra-el-c
https://www.pagina12.com.ar/secciones/sociedad?page=183;Una nena de cuatro años demostró tener un coeficiente similar al de Albert Einstein;https://www.pagina12.com.ar/343571-una-nena-de-cuatro-anos-demostro-tener-un-coeficiente-simila
https://www.pagina12.com.ar/secciones/sociedad?page=183;Ciclo de conferencias de cultura digital y educación para docentes;https://www.pagina12.com.ar/343564-ciclo-de-conferencias-de-cultura-digital-y-educacion-para-do
https://www.pagina12.com.ar/secciones/sociedad?page=184;Clima en Buenos Aires: el pronóstico del tiempo para este lunes 24 de mayo;https://www.pagina12.com.ar/343533-clima-en-buenos-aires-el-pronostico-del-tiempo-para-este-lun
https://www.pagina12.com.ar/secciones/sociedad?page=184;Efemérides de hoy: qué pasó un 24 de mayo ;https://www.pagina12.com.ar/343284-efemerides-de-hoy-que-paso-un-24-de-mayo
https://www.pagina12.com.ar/secciones/sociedad?page=184;Coronavirus: desarrollan el primer hisopo nasofaríngeo 100 por ciento nacional ;https://www.pagina12.com.ar/343406-coronavirus-desarrollan-el-primer-hisopo-nasofaringeo-100-po
https://www.pagina12.com.ar/secciones/sociedad?page=184;Tragedia en China: 21 atletas murieron por hipotermia en una carrera de montaña;https://www.pagina12.com.ar/343421-tragedia-en-china-21-atletas-murieron-por-hipotermia-en-una-
https://www.pagina12.com.ar/secciones/sociedad?page=184;Coronavirus en Argentina: se registraron 24.801 casos y 375 muertes ;https://www.pagina12.com.ar/343423-coronavirus-en-argentina-se-registraron-24-801-casos-y-375-m
https://www.pagina12.com.ar/secciones/sociedad?page=184;Ciudad: desbaratan una fiesta clandestina con más de 140 personas;https://www.pagina12.com.ar/343429-ciudad-desbaratan-una-fiesta-clandestina-con-mas-de-140-pers
https://www.pagina12.com.ar/secciones/sociedad?page=184;Esto es ODIO;https://www.pagina12.com.ar/343456-esto-es-odio
https://www.pagina12.com.ar/secciones/sociedad?page=184;Violencia de género: en pandemia se incrementó el incumplimiento de la cuota alimentaria;https://www.pagina12.com.ar/343488-violencia-de-genero-en-pandemia-se-incremento-el-incumplimie
https://www.pagina12.com.ar/secciones/sociedad?page=184;A quiénes citarán a vacunarse esta semana;https://www.pagina12.com.ar/343298-a-quienes-citaran-a-vacunarse-esta-semana
https://www.pagina12.com.ar/secciones/sociedad?page=184;Italia: al menos 14 muertos y un herido grave por la caída de un teleférico;https://www.pagina12.com.ar/343389-italia-al-menos-14-muertos-y-un-herido-grave-por-la-caida-de
https://www.pagina12.com.ar/secciones/sociedad?page=184;Sputnik V: aterrizó en Moscú un nuevo vuelo de Aerolíneas;https://www.pagina12.com.ar/343479-sputnik-v-aterrizo-en-moscu-un-nuevo-vuelo-de-aerolineas
https://www.pagina12.com.ar/secciones/sociedad?page=185;Un estudio demostró que las vacunas de AstraZeneca y Pfizer son eficaces contra la variante india;https://www.pagina12.com.ar/343400-un-estudio-demostro-que-las-vacunas-de-astra-zeneca-y-pfizer
https://www.pagina12.com.ar/secciones/sociedad?page=185;Moderna admite que será necesaria una tercera dosis de su vacuna contra la Covid;https://www.pagina12.com.ar/343396-moderna-admite-que-sera-necesaria-una-tercera-dosis-de-su-va
https://www.pagina12.com.ar/secciones/sociedad?page=185;Alerta sobre fraudes y estafas con programas sociales ;https://www.pagina12.com.ar/343385-alerta-sobre-fraudes-y-estafas-con-programas-sociales
https://www.pagina12.com.ar/secciones/sociedad?page=185;Clima en Buenos Aires: el pronóstico del tiempo para este domingo 23 de mayo;https://www.pagina12.com.ar/343383-clima-en-buenos-aires-el-pronostico-del-tiempo-para-este-dom
https://www.pagina12.com.ar/secciones/sociedad?page=185;Efemérides de hoy: qué pasó un 23 de mayo;https://www.pagina12.com.ar/343283-efemerides-de-hoy-que-paso-un-23-de-mayo
https://www.pagina12.com.ar/secciones/sociedad?page=185;El jefe de Gabinete de la Ciudad, Felipe Miguel, dio positivo de Covid;https://www.pagina12.com.ar/343251-el-jefe-de-gabinete-de-la-ciudad-felipe-miguel-dio-positivo-
https://www.pagina12.com.ar/secciones/sociedad?page=185;Avances decisivos en la vacunación;https://www.pagina12.com.ar/343290-avances-decisivos-en-la-vacunacion
https://www.pagina12.com.ar/secciones/sociedad?page=185;Qué hizo, qué hace y qué hará el Gobierno para conseguir vacunas  ;https://www.pagina12.com.ar/343297-que-hizo-que-hace-y-que-hara-el-gobierno-para-conseguir-vacu
https://www.pagina12.com.ar/secciones/sociedad?page=185;Coronavirus: La ciudad protegida;https://www.pagina12.com.ar/343311-coronavirus-la-ciudad-protegida
https://www.pagina12.com.ar/secciones/sociedad?page=185;Perpetua para un femicida;https://www.pagina12.com.ar/343316-perpetua-para-un-femicida
https://www.pagina12.com.ar/secciones/sociedad?page=185;Hallaron una exótica pareja de leopardos de Persia;https://www.pagina12.com.ar/343279-hallaron-una-exotica-pareja-de-leopardos-de-persia
https://www.pagina12.com.ar/secciones/sociedad?page=186;Coronavirus en Argentina: se registraron 32.171 casos y 297 muertes ;https://www.pagina12.com.ar/343271-coronavirus-en-argentina-se-registraron-32-171-casos-y-297-m
https://www.pagina12.com.ar/secciones/sociedad?page=186;Una familia rescató un águila coronada, especie en peligro de extinción;https://www.pagina12.com.ar/343265-una-familia-rescato-un-aguila-coronada-especie-en-peligro-de
https://www.pagina12.com.ar/secciones/sociedad?page=186;Efemérides de hoy: qué pasó un 22 de mayo ;https://www.pagina12.com.ar/342863-efemerides-de-hoy-que-paso-un-22-de-mayo
https://www.pagina12.com.ar/secciones/sociedad?page=186;Un estudio reveló que el olfato canino es muy fiable para detectar covid;https://www.pagina12.com.ar/343090-un-estudio-revelo-que-el-olfato-canino-es-muy-fiable-para-de
https://www.pagina12.com.ar/secciones/sociedad?page=186;La BBC en la mira, después del escándalo por la entrevista a Lady Di en 1995;https://www.pagina12.com.ar/343106-la-bbc-en-la-mira-despues-del-escandalo-por-la-entrevista-a-
https://www.pagina12.com.ar/secciones/sociedad?page=186;Coronavirus en Argentina: se registraron 35.468 casos y 695 muertes ;https://www.pagina12.com.ar/343114-coronavirus-en-argentina-se-registraron-35-468-casos-y-695-m
https://www.pagina12.com.ar/secciones/sociedad?page=186;El GCBA desalojó Los Platitos;https://www.pagina12.com.ar/343127-el-gcba-desalojo-los-platitos
https://www.pagina12.com.ar/secciones/sociedad?page=186;Coronavirus: algunas provincias quieren comprar sus propias vacunas;https://www.pagina12.com.ar/343128-coronavirus-algunas-provincias-quieren-comprar-sus-propias-v
https://www.pagina12.com.ar/secciones/sociedad?page=186;Coronavirus: el sex appeal de las vacunas;https://www.pagina12.com.ar/343132-coronavirus-el-sex-appeal-de-las-vacunas
https://www.pagina12.com.ar/secciones/sociedad?page=186;Una comisaría móvil para mejorar el tiempo de respuesta;https://www.pagina12.com.ar/343148-una-comisaria-movil-para-mejorar-el-tiempo-de-respuesta
https://www.pagina12.com.ar/secciones/sociedad?page=186;Procesaron al hombre que volvió de Miami y ocultó que tenía covid-19;https://www.pagina12.com.ar/343050-procesaron-al-hombre-que-volvio-de-miami-y-oculto-que-tenia-
https://www.pagina12.com.ar/secciones/sociedad?page=187;Un fallo ordenó garantizar la educación virtual en el colegio Mariano Acosta;https://www.pagina12.com.ar/343150-un-fallo-ordeno-garantizar-la-educacion-virtual-en-el-colegi
https://www.pagina12.com.ar/secciones/sociedad?page=187;La historia detrás de la Ley Johanna: “Somos el grito de las que parimos invisibilizadas”;https://www.pagina12.com.ar/343069-la-historia-detras-de-la-ley-johanna-somos-el-grito-de-las-q
https://www.pagina12.com.ar/secciones/sociedad?page=187;La fiscalía pidió prisión en suspenso y la querella, perpetua;https://www.pagina12.com.ar/343179-la-fiscalia-pidio-prision-en-suspenso-y-la-querella-perpetua
https://www.pagina12.com.ar/secciones/sociedad?page=187;Cerraron el delivery de ruedas robadas;https://www.pagina12.com.ar/343145-cerraron-el-delivery-de-ruedas-robadas
https://www.pagina12.com.ar/secciones/sociedad?page=187;Anita Co, sobreseída en la causa por injurias que le inició Darthés ;https://www.pagina12.com.ar/343140-anita-co-sobreseida-en-la-causa-por-injurias-que-le-inicio-d
https://www.pagina12.com.ar/secciones/sociedad?page=187;"La Justicia de EE. UU. se llevó a más de 50 felinos del parque que inspiró la serie ""Tiger King""";https://www.pagina12.com.ar/343098-la-justicia-de-ee-uu-se-llevo-a-mas-de-50-felinos-del-parque
https://www.pagina12.com.ar/secciones/sociedad?page=187;Lady Gaga contó que quedó embarazada tras sufrir un abuso sexual a los 19 años;https://www.pagina12.com.ar/343089-lady-gaga-conto-que-quedo-embarazada-tras-sufrir-un-abuso-se
https://www.pagina12.com.ar/secciones/sociedad?page=187;Alerta en Buenos Aires por la llegada de un ciclón extratropical;https://www.pagina12.com.ar/343080-alerta-en-buenos-aires-por-la-llegada-de-un-ciclon-extratrop
https://www.pagina12.com.ar/secciones/sociedad?page=187;Tarjeta Alimentar: todos los detalles sobre el saldo y el nuevo cronograma de pago;https://www.pagina12.com.ar/343079-tarjeta-alimentar-todos-los-detalles-sobre-el-saldo-y-el-nue
https://www.pagina12.com.ar/secciones/sociedad?page=187;WhatsApp suma una función para migrar el historial de chats a otro número de teléfono;https://www.pagina12.com.ar/343075-whats-app-suma-una-funcion-para-migrar-el-historial-de-chats
https://www.pagina12.com.ar/secciones/sociedad?page=187;Para la OMS las cifras de muertos por coronavirus son hasta 3 veces más que las oficiales;https://www.pagina12.com.ar/343042-para-la-oms-las-cifras-de-muertos-por-coronavirus-son-hasta-
https://www.pagina12.com.ar/secciones/sociedad?page=188;Clima en Buenos Aires: el pronóstico del tiempo para este viernes 21 de mayo;https://www.pagina12.com.ar/343029-clima-en-buenos-aires-el-pronostico-del-tiempo-para-este-vie
https://www.pagina12.com.ar/secciones/sociedad?page=188;Efemérides de hoy: qué pasó un 21 de mayo ;https://www.pagina12.com.ar/342864-efemerides-de-hoy-que-paso-un-21-de-mayo
https://www.pagina12.com.ar/secciones/sociedad?page=188;Coronavirus en Argentina: se registraron 35.884 casos y 435 muertes;https://www.pagina12.com.ar/342867-coronavirus-en-argentina-se-registraron-35-884-casos-y-435-m
https://www.pagina12.com.ar/secciones/sociedad?page=188;"Un fallo de la Corte permite a los supermercados cerrar los domingos
 ";https://www.pagina12.com.ar/342880-un-fallo-de-la-corte-permite-a-los-supermercados-cerrar-los-
https://www.pagina12.com.ar/secciones/sociedad?page=188;"CABA: la Justicia frenó la subasta de un predio que el Gobierno declaró ""ocioso"" aunque allí haya oficinas públicas";https://www.pagina12.com.ar/342886-caba-la-justicia-freno-la-subasta-de-un-predio-que-el-gobier
https://www.pagina12.com.ar/secciones/sociedad?page=188;Chocobar: hora de alegatos de la fiscalía y la querella;https://www.pagina12.com.ar/342900-chocobar-hora-de-alegatos-de-la-fiscalia-y-la-querella
https://www.pagina12.com.ar/secciones/sociedad?page=188;"""Certificado covid digital"", un pasaporte para favorecer el turismo";https://www.pagina12.com.ar/342909-certificado-covid-digital-un-pasaporte-para-favorecer-el-tur
https://www.pagina12.com.ar/secciones/sociedad?page=188;El Tribunal Oral en lo Criminal 1 de Dolores juzgará a los ocho rugbiers;https://www.pagina12.com.ar/342917-el-tribunal-oral-en-lo-criminal-1-de-dolores-juzgara-a-los-o
https://www.pagina12.com.ar/secciones/sociedad?page=188;Alperovich: la Corte definió que la causa por abuso sexual debe ser tramitada en Buenos Aires;https://www.pagina12.com.ar/342918-alperovich-la-corte-definio-que-la-causa-por-abuso-sexual-de
https://www.pagina12.com.ar/secciones/sociedad?page=188;Las claves de la acusación fiscal por la muerte de Maradona;https://www.pagina12.com.ar/342834-las-claves-de-la-acusacion-fiscal-por-la-muerte-de-maradona
https://www.pagina12.com.ar/secciones/sociedad?page=188;Una empresa argentina mandó a vacunar a sus trabajadores a Miami;https://www.pagina12.com.ar/342835-una-empresa-argentina-mando-a-vacunar-a-sus-trabajadores-a-m
https://www.pagina12.com.ar/secciones/sociedad?page=189;Neuquén: comenzaron a multar a las personas por no usar barbijo;https://www.pagina12.com.ar/342843-neuquen-comenzaron-a-multar-a-las-personas-por-no-usar-barbi
https://www.pagina12.com.ar/secciones/sociedad?page=189;El rover chino mandó sus primeras imágenes desde Marte;https://www.pagina12.com.ar/342855-el-rover-chino-mando-sus-primeras-imagenes-desde-marte
https://www.pagina12.com.ar/secciones/sociedad?page=189;Cómo tramitar el permiso para circular durante el confinamiento;https://www.pagina12.com.ar/342933-como-tramitar-el-permiso-para-circular-durante-el-confinamie
https://www.pagina12.com.ar/secciones/sociedad?page=189;Nuevo confinamiento: cuáles son las actividades que quedarán exceptuadas;https://www.pagina12.com.ar/342910-nuevo-confinamiento-cuales-son-las-actividades-que-quedaran-
https://www.pagina12.com.ar/secciones/sociedad?page=189;El Gobierno restableció el feriado del 24 de mayo;https://www.pagina12.com.ar/342895-el-gobierno-restablecio-el-feriado-del-24-de-mayo
https://www.pagina12.com.ar/secciones/sociedad?page=189;"Llega ""She Taxi"" a Buenos Aires y a todo el país";https://www.pagina12.com.ar/342839-llega-she-taxi-a-buenos-aires-y-a-todo-el-pais
https://www.pagina12.com.ar/secciones/sociedad?page=189;Condena en Francia por las prótesis PIP;https://www.pagina12.com.ar/342819-condena-en-francia-por-las-protesis-pip
https://www.pagina12.com.ar/secciones/sociedad?page=189;Se desprendió de la Antártida el iceberg más grande del mundo;https://www.pagina12.com.ar/342803-se-desprendio-de-la-antartida-el-iceberg-mas-grande-del-mund
https://www.pagina12.com.ar/secciones/sociedad?page=189;Adiós al Internet Explorer: Microsoft le puso fecha definitiva al fin del navegador;https://www.pagina12.com.ar/342801-adios-al-internet-explorer-microsoft-le-puso-fecha-definitiv
https://www.pagina12.com.ar/secciones/sociedad?page=189;La Anmat prohibió unos morrones en conserva;https://www.pagina12.com.ar/342796-la-anmat-prohibio-unos-morrones-en-conserva
https://www.pagina12.com.ar/secciones/sociedad?page=189;Coronavirus: según la OMS, las vacunas son eficaces contra todas las variantes;https://www.pagina12.com.ar/342795-coronavirus-segun-la-oms-las-vacunas-son-eficaces-contra-tod
https://www.pagina12.com.ar/secciones/sociedad?page=190;Clima en Buenos Aires: el pronóstico del tiempo para este jueves 20 de mayo;https://www.pagina12.com.ar/342790-clima-en-buenos-aires-el-pronostico-del-tiempo-para-este-jue
https://www.pagina12.com.ar/secciones/sociedad?page=190;Efemérides de hoy: qué pasó un 20 de mayo;https://www.pagina12.com.ar/342386-efemerides-de-hoy-que-paso-un-20-de-mayo
https://www.pagina12.com.ar/secciones/sociedad?page=190;Frío cero también en pandemia;https://www.pagina12.com.ar/342705-frio-cero-tambien-en-pandemia
https://www.pagina12.com.ar/secciones/sociedad?page=190;En CABA se registraron más cesáreas desde el comienzo de la pandemia;https://www.pagina12.com.ar/342578-en-caba-se-registraron-mas-cesareas-desde-el-comienzo-de-la-
https://www.pagina12.com.ar/secciones/sociedad?page=190;Un caso de rabia en Coronel Suárez;https://www.pagina12.com.ar/342581-un-caso-de-rabia-en-coronel-suarez
https://www.pagina12.com.ar/secciones/sociedad?page=190;Chocobar: piden absolver al menor;https://www.pagina12.com.ar/342717-chocobar-piden-absolver-al-menor
https://www.pagina12.com.ar/secciones/sociedad?page=190;Causa Maradona: imputan homicidio simple por dolo eventual;https://www.pagina12.com.ar/342724-causa-maradona-imputan-homicidio-simple-por-dolo-eventual
https://www.pagina12.com.ar/secciones/sociedad?page=190;"Salta: la fiscal penal de Derechos Humanos denunció por violencia de género a un diputado nacional que la calificó de ""atorranta"" ";https://www.pagina12.com.ar/342604-salta-la-fiscal-penal-de-derechos-humanos-denuncio-por-viole
https://www.pagina12.com.ar/secciones/sociedad?page=190;Récord de contagios de coronavirus: se registraron 39.652 casos y 494 muertes;https://www.pagina12.com.ar/342648-record-de-contagios-de-coronavirus-se-registraron-39-652-cas
https://www.pagina12.com.ar/secciones/sociedad?page=190;Coronavirus: “Vamos a empezar a contar muertos en las calles si nada cambia”  ;https://www.pagina12.com.ar/342661-coronavirus-vamos-a-empezar-a-contar-muertos-en-las-calles-s
https://www.pagina12.com.ar/secciones/sociedad?page=190;Se cumplen dos años de la masacre de San Miguel del Monte;https://www.pagina12.com.ar/342682-se-cumplen-dos-anos-de-la-masacre-de-san-miguel-del-monte
https://www.pagina12.com.ar/secciones/sociedad?page=191;Una enfermería permanente en cada escuela;https://www.pagina12.com.ar/342689-una-enfermeria-permanente-en-cada-escuela
https://www.pagina12.com.ar/secciones/sociedad?page=191;Convocan a crear espacios seguros para abejas en los balcones porteños;https://www.pagina12.com.ar/342711-convocan-a-crear-espacios-seguros-para-abejas-en-los-balcone
https://www.pagina12.com.ar/secciones/sociedad?page=191;"Lock out ganadero: organizaciones sociales harán un ""verdurazo"" en el Obelisco";https://www.pagina12.com.ar/342709-lock-out-ganadero-organizaciones-sociales-haran-un-verdurazo
https://www.pagina12.com.ar/secciones/sociedad?page=191;Diego Maradona: imputan por homicidio con dolo eventual al médico Leopoldo Luque y a otros seis acusados;https://www.pagina12.com.ar/342693-diego-maradona-imputan-por-homicidio-con-dolo-eventual-al-me
https://www.pagina12.com.ar/secciones/sociedad?page=191;Spotify añadirá la transcripción automática a texto de los podcast;https://www.pagina12.com.ar/342653-spotify-anadira-la-transcripcion-automatica-a-texto-de-los-p
https://www.pagina12.com.ar/secciones/sociedad?page=191;Rabia en Argentina: cómo son los síntomas y de qué manera se previene;https://www.pagina12.com.ar/342631-rabia-en-argentina-como-son-los-sintomas-y-de-que-manera-se-
https://www.pagina12.com.ar/secciones/sociedad?page=191;Showmatch: dos abogados denunciaron a Marcelo Tinelli por romper los protocolos sanitarios;https://www.pagina12.com.ar/342623-showmatch-dos-abogados-denunciaron-a-marcelo-tinelli-por-rom
https://www.pagina12.com.ar/secciones/sociedad?page=191;Clases presenciales: la acumulación excesiva de poder no garantiza que las decisiones funcionen;https://www.pagina12.com.ar/342620-clases-presenciales-la-acumulacion-excesiva-de-poder-no-gara
https://www.pagina12.com.ar/secciones/sociedad?page=191;La estrella pop estadounidense Demi Lovato contó que se identifica con el género no binario;https://www.pagina12.com.ar/342603-la-estrella-pop-estadounidense-demi-lovato-conto-que-se-iden
https://www.pagina12.com.ar/secciones/sociedad?page=191;La aduana realiza subastas virtuales de autos, equipos industriales y bebidas;https://www.pagina12.com.ar/342586-la-aduana-realiza-subastas-virtuales-de-autos-equipos-indust
https://www.pagina12.com.ar/secciones/sociedad?page=191;Televisores en 24 cuotas sin interés: el plan del Banco Provincia por la Copa América;https://www.pagina12.com.ar/342559-televisores-en-24-cuotas-sin-interes-el-plan-del-banco-provi
https://www.pagina12.com.ar/secciones/sociedad?page=192;La abogada trans que se postuló para jueza logró rectificar su nombre en registros militares;https://www.pagina12.com.ar/342556-la-abogada-trans-que-se-postulo-para-jueza-logro-rectificar-
https://www.pagina12.com.ar/secciones/sociedad?page=192;La Anmat prohibió la venta de un pollo en escabeche;https://www.pagina12.com.ar/342553-la-anmat-prohibio-la-venta-de-un-pollo-en-escabeche
https://www.pagina12.com.ar/secciones/sociedad?page=192;Europa evalúa permitir el ingreso de turistas vacunados;https://www.pagina12.com.ar/342548-europa-evalua-permitir-el-ingreso-de-turistas-vacunados
https://www.pagina12.com.ar/secciones/sociedad?page=192;Gloria Steinem recibió el Premio Princesa de Asturias de Comunicación y Humanidades 2021;https://www.pagina12.com.ar/342546-gloria-steinem-recibio-el-premio-princesa-de-asturias-de-com
https://www.pagina12.com.ar/secciones/sociedad?page=192;Clima en Buenos Aires: el pronóstico del tiempo para este miércoles 19 de mayo;https://www.pagina12.com.ar/342535-clima-en-buenos-aires-el-pronostico-del-tiempo-para-este-mie
https://www.pagina12.com.ar/secciones/sociedad?page=192;Efemérides de hoy: qué pasó un 19 de mayo;https://www.pagina12.com.ar/342360-efemerides-de-hoy-que-paso-un-19-de-mayo
https://www.pagina12.com.ar/secciones/sociedad?page=192;Ataque homofóbico de un grupo de militantes de Gómez Centurión en el Obelisco;https://www.pagina12.com.ar/342406-ataque-homofobico-de-un-grupo-de-militantes-de-gomez-centuri
https://www.pagina12.com.ar/secciones/sociedad?page=192;Un policía porteño detenido tras ser denunciado por violar a una chica en el shopping Distrito Arcos;https://www.pagina12.com.ar/342434-un-policia-porteno-detenido-tras-ser-denunciado-por-violar-a
https://www.pagina12.com.ar/secciones/sociedad?page=192;Coronavirus: un estudio señaló que es seguro combinar vacunas de Astrazeneca y Pfizer;https://www.pagina12.com.ar/342328-coronavirus-un-estudio-senalo-que-es-seguro-combinar-vacunas
https://www.pagina12.com.ar/secciones/sociedad?page=192;"Para Luque, la junta médica tiene ""errores conceptuales muy marcados""";https://www.pagina12.com.ar/342437-para-luque-la-junta-medica-tiene-errores-conceptuales-muy-ma
https://www.pagina12.com.ar/secciones/sociedad?page=192;Descubrieron el “talón de Aquiles” del coronavirus ;https://www.pagina12.com.ar/342332-descubrieron-el-talon-de-aquiles-del-coronavirus
https://www.pagina12.com.ar/secciones/sociedad?page=193;Un acusado de femicidio cumple prisión domiciliaria en la casa de sus suegros;https://www.pagina12.com.ar/342446-un-acusado-de-femicidio-cumple-prision-domiciliaria-en-la-ca
https://www.pagina12.com.ar/secciones/sociedad?page=193;Dos fuertes acusaciones para el psiquiatra;https://www.pagina12.com.ar/342458-dos-fuertes-acusaciones-para-el-psiquiatra
https://www.pagina12.com.ar/secciones/sociedad?page=193;Abusos en el Provolo: el presidente del Tribunal se inhibió en el proceso;https://www.pagina12.com.ar/342339-abusos-en-el-provolo-el-presidente-del-tribunal-se-inhibio-e
https://www.pagina12.com.ar/secciones/sociedad?page=193;Un estado narco paralelo;https://www.pagina12.com.ar/342467-un-estado-narco-paralelo
https://www.pagina12.com.ar/secciones/sociedad?page=193;Cinco municipios bonaerenes pasan a Fase 2 por el aumento de casos;https://www.pagina12.com.ar/342355-cinco-municipios-bonaerenes-pasan-a-fase-2-por-el-aumento-de
https://www.pagina12.com.ar/secciones/sociedad?page=193;Récord de contagios y muertes por coronavirus: se registraron 35.543 casos y 745 fallecimientos;https://www.pagina12.com.ar/342392-record-de-contagios-y-muertes-por-coronavirus-se-registraron
https://www.pagina12.com.ar/secciones/sociedad?page=193;Los cuatro puntos que le exige la comunidad educativa al gobierno porteño;https://www.pagina12.com.ar/342507-los-cuatro-puntos-que-le-exige-la-comunidad-educativa-al-gob
https://www.pagina12.com.ar/secciones/sociedad?page=193;Coronavirus: récord de casos en nueve provincias;https://www.pagina12.com.ar/342461-coronavirus-record-de-casos-en-nueve-provincias
https://www.pagina12.com.ar/secciones/sociedad?page=193;Pánico en China: un rascacielos tembló aunque no se registró ningún sismo;https://www.pagina12.com.ar/342435-panico-en-china-un-rascacielos-temblo-aunque-no-se-registro-
https://www.pagina12.com.ar/secciones/sociedad?page=193;Tucumán: 15 localidades vuelven a Fase 1;https://www.pagina12.com.ar/342405-tucuman-15-localidades-vuelven-a-fase-1
https://www.pagina12.com.ar/secciones/sociedad?page=193;"Roger Waters y su recuerdo de Ramona Medina: ""Una de nuestras heroínas""";https://www.pagina12.com.ar/342396-roger-waters-y-su-recuerdo-de-ramona-medina-una-de-nuestras-
