pagSeccion;titulo;href
https://www.pagina12.com.ar/secciones/economia?page=401;Respaldo de los trabajadores a la intervención de Vicentin;https://www.pagina12.com.ar/274219-respaldo-de-los-trabajadores-a-la-intervencion-de-vicentin
https://www.pagina12.com.ar/secciones/economia?page=401;El comienzo de la pandemia en la economía;https://www.pagina12.com.ar/274220-el-comienzo-de-la-pandemia-en-la-economia
https://www.pagina12.com.ar/secciones/economia?page=401;Con todas las habitaciones de los hoteles sin ocupar;https://www.pagina12.com.ar/274223-con-todas-las-habitaciones-de-los-hoteles-sin-ocupar
https://www.pagina12.com.ar/secciones/economia?page=401;Movimientos sociales, por la expropiación;https://www.pagina12.com.ar/274224-movimientos-sociales-por-la-expropiacion
https://www.pagina12.com.ar/secciones/economia?page=402;Desempleo de 10,4 por ciento en el primer trimestre;https://www.pagina12.com.ar/274225-desempleo-de-10-4-por-ciento-en-el-primer-trimestre
https://www.pagina12.com.ar/secciones/economia?page=402;El mercado bursátil argentino sigue siendo emergente;https://www.pagina12.com.ar/274227-el-mercado-bursatil-argentino-sigue-siendo-emergente
https://www.pagina12.com.ar/secciones/economia?page=402;"Deuda externa: Guzmán espera un ""mejor entendimiento"" con los acreedores";https://www.pagina12.com.ar/274188-deuda-externa-guzman-espera-un-mejor-entendimiento-con-los-a
https://www.pagina12.com.ar/secciones/economia?page=402;El Gobierno oficializó el pago en cuotas del aguinaldo a estatales;https://www.pagina12.com.ar/274045-el-gobierno-oficializo-el-pago-en-cuotas-del-aguinaldo-a-est
https://www.pagina12.com.ar/secciones/economia?page=402;AUH junio 2020: quiénes cobran este martes 23 de junio;https://www.pagina12.com.ar/270979-auh-junio-2020-quienes-cobran-este-martes-23-de-junio
https://www.pagina12.com.ar/secciones/economia?page=402;Las claves de la moratoria impositiva que se viene;https://www.pagina12.com.ar/273987-las-claves-de-la-moratoria-impositiva-que-se-viene
https://www.pagina12.com.ar/secciones/economia?page=402;Más gasto público para atajar los costos de la pandemia;https://www.pagina12.com.ar/273989-mas-gasto-publico-para-atajar-los-costos-de-la-pandemia
https://www.pagina12.com.ar/secciones/economia?page=402;Vicentin: denuncian maniobras de vaciamiento ;https://www.pagina12.com.ar/273997-vicentin-denuncian-maniobras-de-vaciamiento
https://www.pagina12.com.ar/secciones/economia?page=402;El Gobierno anunció una reducción de la deuda pública en pesos;https://www.pagina12.com.ar/273887-el-gobierno-anuncio-una-reduccion-de-la-deuda-publica-en-pes
https://www.pagina12.com.ar/secciones/economia?page=402;"""Los de Vicentin chocaron la calesita""";https://www.pagina12.com.ar/273953-los-de-vicentin-chocaron-la-calesita
https://www.pagina12.com.ar/secciones/economia?page=402;Autos: más demanda y algunas demoras;https://www.pagina12.com.ar/273955-autos-mas-demanda-y-algunas-demoras
https://www.pagina12.com.ar/secciones/economia?page=403;El impuesto a los ricos como sentido común;https://www.pagina12.com.ar/273964-el-impuesto-a-los-ricos-como-sentido-comun
https://www.pagina12.com.ar/secciones/economia?page=403;La industria toco fondo por el coronavirus;https://www.pagina12.com.ar/273970-la-industria-toco-fondo-por-el-coronavirus
https://www.pagina12.com.ar/secciones/economia?page=403;Política para cercar la especulación con el dólar Bolsa;https://www.pagina12.com.ar/273979-politica-para-cercar-la-especulacion-con-el-dolar-bolsa
https://www.pagina12.com.ar/secciones/economia?page=403;El foco en los créditos a Vicentin;https://www.pagina12.com.ar/273985-el-foco-en-los-creditos-a-vicentin
https://www.pagina12.com.ar/secciones/economia?page=403;Tablet gratis: para quiénes son los dispositivos que repartirá el Gobierno ;https://www.pagina12.com.ar/273960-tablet-gratis-para-quienes-son-los-dispositivos-que-repartir
https://www.pagina12.com.ar/secciones/economia?page=403;La Sociedad Rural de Córdoba acusó a Vicentin de estafar a los productores;https://www.pagina12.com.ar/273921-la-sociedad-rural-de-cordoba-acuso-a-vicentin-de-estafar-a-l
https://www.pagina12.com.ar/secciones/economia?page=403;AUH junio 2020: la ANSES fijó las fechas de cobro ;https://www.pagina12.com.ar/269066-auh-junio-2020-la-anses-fijo-las-fechas-de-cobro
https://www.pagina12.com.ar/secciones/economia?page=403;Amplían red de distribución de garrafas sociales;https://www.pagina12.com.ar/273751-amplian-red-de-distribucion-de-garrafas-sociales
https://www.pagina12.com.ar/secciones/economia?page=403;No se salvó ni el Día del Padre;https://www.pagina12.com.ar/273757-no-se-salvo-ni-el-dia-del-padre
https://www.pagina12.com.ar/secciones/economia?page=403;Juan José Aranguren será denunciado por el Enargas;https://www.pagina12.com.ar/273765-juan-jose-aranguren-sera-denunciado-por-el-enargas
https://www.pagina12.com.ar/secciones/economia?page=403;El software a la espera de un guiño oficial;https://www.pagina12.com.ar/273776-el-software-a-la-espera-de-un-guino-oficial
https://www.pagina12.com.ar/secciones/economia?page=404;La Provincia sigue negociando;https://www.pagina12.com.ar/273781-la-provincia-sigue-negociando
https://www.pagina12.com.ar/secciones/economia?page=404;"El Gobierno y Vicentin: ""Hoy la expropiación es el último recurso""";https://www.pagina12.com.ar/273788-el-gobierno-y-vicentin-hoy-la-expropiacion-es-el-ultimo-recu
https://www.pagina12.com.ar/secciones/economia?page=404;Nueva ley de alquileres: Qué cambia para los inquilinos;https://www.pagina12.com.ar/273732-nueva-ley-de-alquileres-que-cambia-para-los-inquilinos
https://www.pagina12.com.ar/secciones/economia?page=404;¿Quién podrá volver a volar después de la crisis?;https://www.pagina12.com.ar/273579-quien-podra-volver-a-volar-despues-de-la-crisis
https://www.pagina12.com.ar/secciones/economia?page=404;Quién es Larry Fink, el poderoso dueño de BlackRock;https://www.pagina12.com.ar/273580-quien-es-larry-fink-el-poderoso-dueno-de-black-rock
https://www.pagina12.com.ar/secciones/economia?page=404;El sinuoso camino al rescate de Vicentin ;https://www.pagina12.com.ar/273632-el-sinuoso-camino-al-rescate-de-vicentin
https://www.pagina12.com.ar/secciones/economia?page=404;La industria se recupera de a poco;https://www.pagina12.com.ar/273408-la-industria-se-recupera-de-a-poco
https://www.pagina12.com.ar/secciones/economia?page=404;El suspenso de la deuda seguirá otro mes;https://www.pagina12.com.ar/273409-el-suspenso-de-la-deuda-seguira-otro-mes
https://www.pagina12.com.ar/secciones/economia?page=404;Amplían la ayuda para las cooperativas;https://www.pagina12.com.ar/273421-amplian-la-ayuda-para-las-cooperativas
https://www.pagina12.com.ar/secciones/economia?page=404;Fuerte rebote de las acciones argentinas;https://www.pagina12.com.ar/273430-fuerte-rebote-de-las-acciones-argentinas
https://www.pagina12.com.ar/secciones/economia?page=404;Aumentan los cigarrillos;https://www.pagina12.com.ar/273433-aumentan-los-cigarrillos
https://www.pagina12.com.ar/secciones/economia?page=405;La apuesta de Latam para despedir barato ;https://www.pagina12.com.ar/273436-la-apuesta-de-latam-para-despedir-barato
https://www.pagina12.com.ar/secciones/economia?page=405;No hay Vicentin sin soberanía fluvial, marítima y logística;https://www.pagina12.com.ar/273441-no-hay-vicentin-sin-soberania-fluvial-maritima-y-logistica
https://www.pagina12.com.ar/secciones/economia?page=405;Las empresas de luz y gas envían boletas estimadas por encima de lo pautado;https://www.pagina12.com.ar/273447-las-empresas-de-luz-y-gas-envian-boletas-estimadas-por-encim
https://www.pagina12.com.ar/secciones/economia?page=405;El turismo en alerta por Latam;https://www.pagina12.com.ar/273456-el-turismo-en-alerta-por-latam
https://www.pagina12.com.ar/secciones/economia?page=405;"El ""plan alivio"" seguirá durante la pandemia";https://www.pagina12.com.ar/273462-el-plan-alivio-seguira-durante-la-pandemia
https://www.pagina12.com.ar/secciones/economia?page=405;Nueva alternativa para el manejo de Vicentin;https://www.pagina12.com.ar/273482-nueva-alternativa-para-el-manejo-de-vicentin
https://www.pagina12.com.ar/secciones/economia?page=405;El Gobierno prorrogó el congelamiento de tarifas y la prohibición de cortes de los servicios públicos;https://www.pagina12.com.ar/273322-el-gobierno-prorrogo-el-congelamiento-de-tarifas-y-la-prohib
https://www.pagina12.com.ar/secciones/economia?page=405;"Vicentin: Perotti presentó un proyecto que deja ""de lado la expropiación""";https://www.pagina12.com.ar/273438-vicentin-perotti-presento-un-proyecto-que-deja-de-lado-la-ex
https://www.pagina12.com.ar/secciones/economia?page=405;El juez del concurso de Vicentin repuso temporalmente al directorio de la empresa;https://www.pagina12.com.ar/273348-el-juez-del-concurso-de-vicentin-repuso-temporalmente-al-dir
https://www.pagina12.com.ar/secciones/economia?page=405;"""En Vicentin se define el modelo agroindustrial del país""";https://www.pagina12.com.ar/273207-en-vicentin-se-define-el-modelo-agroindustrial-del-pais
https://www.pagina12.com.ar/secciones/economia?page=405;Latam reparte culpas y no se hace cargo;https://www.pagina12.com.ar/273212-latam-reparte-culpas-y-no-se-hace-cargo
https://www.pagina12.com.ar/secciones/economia?page=406;El nuevo punto de conflicto con los bonistas;https://www.pagina12.com.ar/273222-el-nuevo-punto-de-conflicto-con-los-bonistas
https://www.pagina12.com.ar/secciones/economia?page=406;Nueva colocación de deuda;https://www.pagina12.com.ar/273230-nueva-colocacion-de-deuda
https://www.pagina12.com.ar/secciones/economia?page=406;Auxilio a prestadores turísticos;https://www.pagina12.com.ar/273232-auxilio-a-prestadores-turisticos
https://www.pagina12.com.ar/secciones/economia?page=406;Jueves negro;https://www.pagina12.com.ar/273233-jueves-negro
https://www.pagina12.com.ar/secciones/economia?page=406;Donación de yogur por parte de Danone;https://www.pagina12.com.ar/273234-donacion-de-yogur-por-parte-de-danone
https://www.pagina12.com.ar/secciones/economia?page=406;El gobierno prepara una moratoria;https://www.pagina12.com.ar/273239-el-gobierno-prepara-una-moratoria
https://www.pagina12.com.ar/secciones/economia?page=406;Testigo del Caso Vicentin ;https://www.pagina12.com.ar/273240-testigo-del-caso-vicentin
https://www.pagina12.com.ar/secciones/economia?page=406;Créditos a tasa cero;https://www.pagina12.com.ar/273241-creditos-a-tasa-cero
https://www.pagina12.com.ar/secciones/economia?page=406;Apoyo gremial a la expropiación;https://www.pagina12.com.ar/273243-apoyo-gremial-a-la-expropiacion
https://www.pagina12.com.ar/secciones/economia?page=406;"La decisión de Trump anuncia ""malos tiempos""";https://www.pagina12.com.ar/273250-la-decision-de-trump-anuncia-malos-tiempos
https://www.pagina12.com.ar/secciones/economia?page=406;En moto para esquivar el virus;https://www.pagina12.com.ar/273164-en-moto-para-esquivar-el-virus
https://www.pagina12.com.ar/secciones/economia?page=407;Latam: el impacto en la industria turística;https://www.pagina12.com.ar/273196-latam-el-impacto-en-la-industria-turistica
https://www.pagina12.com.ar/secciones/economia?page=407;Precios mayoristas bajo control;https://www.pagina12.com.ar/273244-precios-mayoristas-bajo-control
https://www.pagina12.com.ar/secciones/economia?page=407;Cajeros sin cobro de comisiones;https://www.pagina12.com.ar/273242-cajeros-sin-cobro-de-comisiones
https://www.pagina12.com.ar/secciones/economia?page=407;Latam deja de volar dentro del país;https://www.pagina12.com.ar/272875-latam-deja-de-volar-dentro-del-pais
https://www.pagina12.com.ar/secciones/economia?page=407;El gabinete económico analizó los programas de ayuda a la producción ;https://www.pagina12.com.ar/272935-el-gabinete-economico-analizo-los-programas-de-ayuda-a-la-pr
https://www.pagina12.com.ar/secciones/economia?page=407;Stiglitz y Piketty proponen impuestos a Amazon, Netflix, Facebook y Google ;https://www.pagina12.com.ar/272948-stiglitz-y-piketty-proponen-impuestos-a-amazon-netflix-faceb
https://www.pagina12.com.ar/secciones/economia?page=407;Las canastas permanecieron estables;https://www.pagina12.com.ar/272949-las-canastas-permanecieron-estables
https://www.pagina12.com.ar/secciones/economia?page=407;¿Qué pasa con los pasajes de Latam?;https://www.pagina12.com.ar/272979-que-pasa-con-los-pasajes-de-latam
https://www.pagina12.com.ar/secciones/economia?page=407;Aguinaldo en cuotas para estatales;https://www.pagina12.com.ar/272989-aguinaldo-en-cuotas-para-estatales
https://www.pagina12.com.ar/secciones/economia?page=407;Aerolíneas en crisis;https://www.pagina12.com.ar/272994-aerolineas-en-crisis
https://www.pagina12.com.ar/secciones/economia?page=407;Deuda en default: oferta y contraoferta para seguir la negociación;https://www.pagina12.com.ar/273004-deuda-en-default-oferta-y-contraoferta-para-seguir-la-negoci
https://www.pagina12.com.ar/secciones/economia?page=408;La crisis de Vicentin llegó al seno familiar;https://www.pagina12.com.ar/273009-la-crisis-de-vicentin-llego-al-seno-familiar
https://www.pagina12.com.ar/secciones/economia?page=408;Deuda externa: el Gobierno y los acreedores levantan la confidencialidad de las negociaciones;https://www.pagina12.com.ar/272966-deuda-externa-el-gobierno-y-los-acreedores-levantan-la-confi
https://www.pagina12.com.ar/secciones/economia?page=408;Apoyo de aceiteros a la intervencion de Vicentin;https://www.pagina12.com.ar/272730-apoyo-de-aceiteros-a-la-intervencion-de-vicentin
https://www.pagina12.com.ar/secciones/economia?page=408;Guzmán atiende varios frentes al mismo tiempo;https://www.pagina12.com.ar/272735-guzman-atiende-varios-frentes-al-mismo-tiempo
https://www.pagina12.com.ar/secciones/economia?page=408;Bonos en dólares por papeles en pesos;https://www.pagina12.com.ar/272740-bonos-en-dolares-por-papeles-en-pesos
https://www.pagina12.com.ar/secciones/economia?page=408;"""Vicentin vendió Renova por u$s 122 millones y los ocultó"" ";https://www.pagina12.com.ar/272751-vicentin-vendio-renova-por-u-s-122-millones-y-los-oculto
https://www.pagina12.com.ar/secciones/economia?page=408;Por una condonación de la deuda pública externa de América latina;https://www.pagina12.com.ar/272505-por-una-condonacion-de-la-deuda-publica-externa-de-america-l
https://www.pagina12.com.ar/secciones/economia?page=408;Todavía no hay luz sobre el apagón histórico;https://www.pagina12.com.ar/272689-todavia-no-hay-luz-sobre-el-apagon-historico
https://www.pagina12.com.ar/secciones/economia?page=408;Más afectadas, más auxiliadas;https://www.pagina12.com.ar/272706-mas-afectadas-mas-auxiliadas
https://www.pagina12.com.ar/secciones/economia?page=408;El riesgo de pasar de una crisis sanitaria a otra de alimentos;https://www.pagina12.com.ar/272725-el-riesgo-de-pasar-de-una-crisis-sanitaria-a-otra-de-aliment
https://www.pagina12.com.ar/secciones/economia?page=408;Los medios de pago digitales ganan terreno ;https://www.pagina12.com.ar/272726-los-medios-de-pago-digitales-ganan-terreno
https://www.pagina12.com.ar/secciones/economia?page=409;WhatsApp habilitó una función para enviar dinero y realizar pagos digitales;https://www.pagina12.com.ar/272648-whats-app-habilito-una-funcion-para-enviar-dinero-y-realizar
https://www.pagina12.com.ar/secciones/economia?page=409;"Nuevo apoyo de Kristalina Georgieva a Argentina: ""Vemos una oportunidad si la deuda vuelve a ser sostenible""";https://www.pagina12.com.ar/272393-nuevo-apoyo-de-kristalina-georgieva-a-argentina-vemos-una-op
https://www.pagina12.com.ar/secciones/economia?page=409;Los riesgos del relato uruguayo;https://www.pagina12.com.ar/272493-los-riesgos-del-relato-uruguayo
https://www.pagina12.com.ar/secciones/economia?page=409;La cuarentena ya no es lo que era;https://www.pagina12.com.ar/272497-la-cuarentena-ya-no-es-lo-que-era
https://www.pagina12.com.ar/secciones/economia?page=409;Estrategias para aprovechar el Día del Padre;https://www.pagina12.com.ar/272504-estrategias-para-aprovechar-el-dia-del-padre
https://www.pagina12.com.ar/secciones/economia?page=409;Segundo pago del IFE: se depositará en una cuenta bancaria;https://www.pagina12.com.ar/272515-segundo-pago-del-ife-se-depositara-en-una-cuenta-bancaria
https://www.pagina12.com.ar/secciones/economia?page=409;Acreedores de Vicentin que esperaban el desembarco del Estado;https://www.pagina12.com.ar/272522-acreedores-de-vicentin-que-esperaban-el-desembarco-del-estad
https://www.pagina12.com.ar/secciones/economia?page=409;Mercados al ritmo del coronavirus;https://www.pagina12.com.ar/272532-mercados-al-ritmo-del-coronavirus
https://www.pagina12.com.ar/secciones/economia?page=409;"Luis Basterra habló sobre Vicentin: ""Acá hay una medida que es rescatar la empresa""";https://www.pagina12.com.ar/272429-luis-basterra-hablo-sobre-vicentin-aca-hay-una-medida-que-es
https://www.pagina12.com.ar/secciones/economia?page=409;Vicentin como empresa testigo;https://www.pagina12.com.ar/272319-vicentin-como-empresa-testigo
https://www.pagina12.com.ar/secciones/economia?page=409;Vicentin: habrá expropiación y empresa mixta como YPF;https://www.pagina12.com.ar/272354-vicentin-habra-expropiacion-y-empresa-mixta-como-ypf
https://www.pagina12.com.ar/secciones/economia?page=410;La AFIP retoma la atención al público en 55 de sus oficinas;https://www.pagina12.com.ar/272278-la-afip-retoma-la-atencion-al-publico-en-55-de-sus-oficinas
https://www.pagina12.com.ar/secciones/economia?page=410;¿Qué va a pasar con los precios?;https://www.pagina12.com.ar/272281-que-va-a-pasar-con-los-precios
https://www.pagina12.com.ar/secciones/economia?page=410;El modelo Kulfas, YPF Agro y Vicentin ;https://www.pagina12.com.ar/272171-el-modelo-kulfas-ypf-agro-y-vicentin
https://www.pagina12.com.ar/secciones/economia?page=410;El juego de cajas chinas del grupo Vicentin;https://www.pagina12.com.ar/272203-el-juego-de-cajas-chinas-del-grupo-vicentin
https://www.pagina12.com.ar/secciones/economia?page=410;"""Una timba perversa""";https://www.pagina12.com.ar/272206-una-timba-perversa
https://www.pagina12.com.ar/secciones/economia?page=410;Una mano de Manuel López Obrador en la renegociación de la deuda;https://www.pagina12.com.ar/271910-una-mano-de-manuel-lopez-obrador-en-la-renegociacion-de-la-d
https://www.pagina12.com.ar/secciones/economia?page=410;"Aclaremos quiénes son ""los empresarios""";https://www.pagina12.com.ar/271953-aclaremos-quienes-son-los-empresarios
https://www.pagina12.com.ar/secciones/economia?page=410;Deuda externa: la negociación se estira hasta el 19 de junio;https://www.pagina12.com.ar/271962-deuda-externa-la-negociacion-se-estira-hasta-el-19-de-junio
https://www.pagina12.com.ar/secciones/economia?page=410;Ley de alquileres: cuándo entra en vigencia;https://www.pagina12.com.ar/272021-ley-de-alquileres-cuando-entra-en-vigencia
https://www.pagina12.com.ar/secciones/economia?page=410;La nueva Vicentin: el plan de Alberto Fernández para la cerealera;https://www.pagina12.com.ar/272023-la-nueva-vicentin-el-plan-de-alberto-fernandez-para-la-cerea
https://www.pagina12.com.ar/secciones/economia?page=410;Prepagas: buscan reducir la cuota;https://www.pagina12.com.ar/272037-prepagas-buscan-reducir-la-cuota
