pagSeccion;titulo;href
https://www.pagina12.com.ar/secciones/sociedad?page=215;Lo que un esposo no puede: el caso de la demanda para evitar una IVE;https://www.pagina12.com.ar/339635-lo-que-un-esposo-no-puede-el-caso-de-la-demanda-para-evitar-
https://www.pagina12.com.ar/secciones/sociedad?page=215;"Una empresa financiada por Bill Gates busca controlar el dengue con mosquitos ""autodestructivos""";https://www.pagina12.com.ar/339641-una-empresa-financiada-por-bill-gates-busca-controlar-el-den
https://www.pagina12.com.ar/secciones/sociedad?page=215;En la Ciudad de Buenos Aires sólo quedan 81 camas de terapia intensiva;https://www.pagina12.com.ar/339735-en-la-ciudad-de-buenos-aires-solo-quedan-81-camas-de-terapia
https://www.pagina12.com.ar/secciones/sociedad?page=216;Batalla campal en el Kansas de Vicente López: clientes y mozos a las piñas ;https://www.pagina12.com.ar/339729-batalla-campal-en-el-kansas-de-vicente-lopez-clientes-y-mozo
https://www.pagina12.com.ar/secciones/sociedad?page=216;Un granjero movió una piedra y accidentalmente modificó la frontera entre Francia y Bélgica;https://www.pagina12.com.ar/339697-un-granjero-movio-una-piedra-y-accidentalmente-modifico-la-f
https://www.pagina12.com.ar/secciones/sociedad?page=216;Subastarán cabellos y un pañuelo de Napoleón, a 200 años de su muerte;https://www.pagina12.com.ar/339678-subastaran-cabellos-y-un-panuelo-de-napoleon-a-200-anos-de-s
https://www.pagina12.com.ar/secciones/sociedad?page=216;Demolerán el Hotel Penssylvania, el más grande del mundo;https://www.pagina12.com.ar/339668-demoleran-el-hotel-penssylvania-el-mas-grande-del-mundo
https://www.pagina12.com.ar/secciones/sociedad?page=216;El Gobierno solicitó la remoción de publicaciones irregulares de Mercado Libre, Facebook e Instagram;https://www.pagina12.com.ar/339642-el-gobierno-solicito-la-remocion-de-publicaciones-irregulare
https://www.pagina12.com.ar/secciones/sociedad?page=216;La Agencia Europea de Medicamentos empezó a analizar la vacuna de Sinovac contra el coronavirus;https://www.pagina12.com.ar/339610-la-agencia-europea-de-medicamentos-empezo-a-analizar-la-vacu
https://www.pagina12.com.ar/secciones/sociedad?page=216;Diego Brancatelli fue internado por coronavirus;https://www.pagina12.com.ar/339595-diego-brancatelli-fue-internado-por-coronavirus
https://www.pagina12.com.ar/secciones/sociedad?page=216;Clima en Buenos Aires: el pronóstico del tiempo para este martes 4 de mayo;https://www.pagina12.com.ar/339582-clima-en-buenos-aires-el-pronostico-del-tiempo-para-este-mar
https://www.pagina12.com.ar/secciones/sociedad?page=216;Efemérides de hoy: qué pasó un 4 de mayo ;https://www.pagina12.com.ar/339142-efemerides-de-hoy-que-paso-un-4-de-mayo
https://www.pagina12.com.ar/secciones/sociedad?page=216;Amicus curiae en la causa por desaparición de Tehuel de la Torre;https://www.pagina12.com.ar/339399-amicus-curiae-en-la-causa-por-desaparicion-de-tehuel-de-la-t
https://www.pagina12.com.ar/secciones/sociedad?page=216;La OMS admitió finalmente que la Covid se transmite por el aire;https://www.pagina12.com.ar/339444-la-oms-admitio-finalmente-que-la-covid-se-transmite-por-el-a
https://www.pagina12.com.ar/secciones/sociedad?page=217;Francia le devolverá a la Argentina los restos de un cacique tehuelche;https://www.pagina12.com.ar/339455-francia-le-devolvera-a-la-argentina-los-restos-de-un-cacique
https://www.pagina12.com.ar/secciones/sociedad?page=217;Coronavirus: baja la mortalidad en los adultos mayores;https://www.pagina12.com.ar/339460-coronavirus-baja-la-mortalidad-en-los-adultos-mayores
https://www.pagina12.com.ar/secciones/sociedad?page=217;Comienza el juicio por el femicidio de la adolescente Emilce Ayala;https://www.pagina12.com.ar/339389-comienza-el-juicio-por-el-femicidio-de-la-adolescente-emilce
https://www.pagina12.com.ar/secciones/sociedad?page=217;La trama del caso del pasajero que volvió de Miami y ocultó que tenía covid-19;https://www.pagina12.com.ar/339391-la-trama-del-caso-del-pasajero-que-volvio-de-miami-y-oculto-
https://www.pagina12.com.ar/secciones/sociedad?page=217;Diego Maradona: la mayoría de la junta de peritos demolió a los médicos que lo trataban;https://www.pagina12.com.ar/339510-diego-maradona-la-mayoria-de-la-junta-de-peritos-demolio-a-l
https://www.pagina12.com.ar/secciones/sociedad?page=217;Francia: Un alcalde condenado por violación continúa en funciones desde prisión;https://www.pagina12.com.ar/339521-francia-un-alcalde-condenado-por-violacion-continua-en-funci
https://www.pagina12.com.ar/secciones/sociedad?page=217;En la Ciudad de Buenos Aires sólo quedan 85 camas de terapia intensiva;https://www.pagina12.com.ar/339396-en-la-ciudad-de-buenos-aires-solo-quedan-85-camas-de-terapia
https://www.pagina12.com.ar/secciones/sociedad?page=217;Abusos en el Próvolo: comenzó el segundo juicio;https://www.pagina12.com.ar/339527-abusos-en-el-provolo-comenzo-el-segundo-juicio
https://www.pagina12.com.ar/secciones/sociedad?page=217;Por qué hoy es el Día de la Milanesa;https://www.pagina12.com.ar/339499-por-que-hoy-es-el-dia-de-la-milanesa
https://www.pagina12.com.ar/secciones/sociedad?page=217;Coronavirus: la curva de contagios se desacelera;https://www.pagina12.com.ar/339472-coronavirus-la-curva-de-contagios-se-desacelera
https://www.pagina12.com.ar/secciones/sociedad?page=217;Coronavirus en Argentina: 540 muertes y 15.920 nuevos casos en las últimas 24 horas;https://www.pagina12.com.ar/339465-coronavirus-en-argentina-540-muertes-y-15-920-nuevos-casos-e
https://www.pagina12.com.ar/secciones/sociedad?page=218;Provincia: fueron suspendidos cines, gimnasios y natatorios en la Fase 3;https://www.pagina12.com.ar/339430-provincia-fueron-suspendidos-cines-gimnasios-y-natatorios-en
https://www.pagina12.com.ar/secciones/sociedad?page=218;Alerta por tormentas y posible caída de granizo en Ciudad de Buenos Aires y alrededores;https://www.pagina12.com.ar/339421-alerta-por-tormentas-y-posible-caida-de-granizo-en-ciudad-de
https://www.pagina12.com.ar/secciones/sociedad?page=218;Santa Fe: alertan sobre la falta de camas en la capital provincial;https://www.pagina12.com.ar/339419-santa-fe-alertan-sobre-la-falta-de-camas-en-la-capital-provi
https://www.pagina12.com.ar/secciones/sociedad?page=218;Milagro en Morón: la atropelló un auto a toda velocidad, se levantó y salió caminando;https://www.pagina12.com.ar/339414-milagro-en-moron-la-atropello-un-auto-a-toda-velocidad-se-le
https://www.pagina12.com.ar/secciones/sociedad?page=218;Los casos de covid-19 bajaron 18% en la última semana en la provincia de Buenos Aires;https://www.pagina12.com.ar/339401-los-casos-de-covid-19-bajaron-18-en-la-ultima-semana-en-la-p
https://www.pagina12.com.ar/secciones/sociedad?page=218;Nuevos términos y condiciones de WhatsApp: qué es lo que cambia;https://www.pagina12.com.ar/339400-nuevos-terminos-y-condiciones-de-whats-app-que-es-lo-que-cam
https://www.pagina12.com.ar/secciones/sociedad?page=218;Anmat prohibió dos productos médicos;https://www.pagina12.com.ar/339393-anmat-prohibio-dos-productos-medicos
https://www.pagina12.com.ar/secciones/sociedad?page=218;A 14 años de la desaparición de Madeleine McCann, cómo sigue el caso;https://www.pagina12.com.ar/339390-a-14-anos-de-la-desaparicion-de-madeleine-mc-cann-como-sigue
https://www.pagina12.com.ar/secciones/sociedad?page=218;Los detalles de la muerte de Diego Maradona: a qué hora se dará a conocer el informe de la Junta Médica;https://www.pagina12.com.ar/339381-los-detalles-de-la-muerte-de-diego-maradona-a-que-hora-se-da
https://www.pagina12.com.ar/secciones/sociedad?page=218;Una cuadrilla de albañilas construyó 48 viviendas;https://www.pagina12.com.ar/339296-una-cuadrilla-de-albanilas-construyo-48-viviendas
https://www.pagina12.com.ar/secciones/sociedad?page=218;Covax firmó acuerdo con Moderna para adquirir 500 millones de dosis;https://www.pagina12.com.ar/339374-covax-firmo-acuerdo-con-moderna-para-adquirir-500-millones-d
https://www.pagina12.com.ar/secciones/sociedad?page=219;Clima en Buenos Aires: el pronóstico del tiempo para este lunes 3 de mayo;https://www.pagina12.com.ar/339372-clima-en-buenos-aires-el-pronostico-del-tiempo-para-este-lun
https://www.pagina12.com.ar/secciones/sociedad?page=219;Efemérides de hoy: qué pasó un 3 de mayo;https://www.pagina12.com.ar/339140-efemerides-de-hoy-que-paso-un-3-de-mayo
https://www.pagina12.com.ar/secciones/sociedad?page=219;San Juan: la Justicia suspendió una IVE por pedido de la expareja de una mujer que había solicitado acceder al aborto;https://www.pagina12.com.ar/339264-san-juan-la-justicia-suspendio-una-ive-por-pedido-de-la-expa
https://www.pagina12.com.ar/secciones/sociedad?page=219;Coronavirus en Argentina: se registraron 11.394  casos y 156 muertes  ;https://www.pagina12.com.ar/339266-coronavirus-en-argentina-se-registraron-11-394-casos-y-156-m
https://www.pagina12.com.ar/secciones/sociedad?page=219;Coronavirus: volvía de Miami, ocultó que tenía covid-19 y fue detenido en el Aeropuerto de Ezeiza;https://www.pagina12.com.ar/339278-coronavirus-volvia-de-miami-oculto-que-tenia-covid-19-y-fue-
https://www.pagina12.com.ar/secciones/sociedad?page=219;Liliana Romero;https://www.pagina12.com.ar/339308-liliana-romero
https://www.pagina12.com.ar/secciones/sociedad?page=219;Cuidar y salvar vidas;https://www.pagina12.com.ar/339313-cuidar-y-salvar-vidas
https://www.pagina12.com.ar/secciones/sociedad?page=219;Diego Iluminado;https://www.pagina12.com.ar/339320-diego-iluminado
https://www.pagina12.com.ar/secciones/sociedad?page=219;Clases presenciales: alarmante porcentaje de fallas en los protocolos de las escuelas porteñas;https://www.pagina12.com.ar/339342-clases-presenciales-alarmante-porcentaje-de-fallas-en-los-pr
https://www.pagina12.com.ar/secciones/sociedad?page=219;Conclusiones, filtraciones y acusaciones por la muerte de Diego Maradona;https://www.pagina12.com.ar/339236-conclusiones-filtraciones-y-acusaciones-por-la-muerte-de-die
https://www.pagina12.com.ar/secciones/sociedad?page=219;Fiesta clandestina en Nordelta: más de 70 personas y cumbia a todo volumen;https://www.pagina12.com.ar/339249-fiesta-clandestina-en-nordelta-mas-de-70-personas-y-cumbia-a
https://www.pagina12.com.ar/secciones/sociedad?page=220;India sigue recibiendo ayuda de distintos países ante el avance de la pandemia;https://www.pagina12.com.ar/339229-india-sigue-recibiendo-ayuda-de-distintos-paises-ante-el-ava
https://www.pagina12.com.ar/secciones/sociedad?page=220;Clima en Buenos Aires: el pronóstico del tiempo para este domingo 2 de mayo;https://www.pagina12.com.ar/339221-clima-en-buenos-aires-el-pronostico-del-tiempo-para-este-dom
https://www.pagina12.com.ar/secciones/sociedad?page=220;Efemérides de hoy: qué pasó un 2 de mayo;https://www.pagina12.com.ar/339139-efemerides-de-hoy-que-paso-un-2-de-mayo
https://www.pagina12.com.ar/secciones/sociedad?page=220;Coronavirus en Argentina: se registraron 16.502 nuevos casos y 231 muertes;https://www.pagina12.com.ar/339101-coronavirus-en-argentina-se-registraron-16-502-nuevos-casos-
https://www.pagina12.com.ar/secciones/sociedad?page=220;A un año del cierre de Villa Azul;https://www.pagina12.com.ar/339129-a-un-ano-del-cierre-de-villa-azul
https://www.pagina12.com.ar/secciones/sociedad?page=220;Las nuevas citaciones para vacunar: cerca de un millón en el AMBA;https://www.pagina12.com.ar/339149-las-nuevas-citaciones-para-vacunar-cerca-de-un-millon-en-el-
https://www.pagina12.com.ar/secciones/sociedad?page=220;Cuando el código postal pesa más que el código genético;https://www.pagina12.com.ar/339153-cuando-el-codigo-postal-pesa-mas-que-el-codigo-genetico
https://www.pagina12.com.ar/secciones/sociedad?page=220;Las secuelas del coronavirus, en primera persona;https://www.pagina12.com.ar/339136-las-secuelas-del-coronavirus-en-primera-persona
https://www.pagina12.com.ar/secciones/sociedad?page=220;El volcán Pacaya expulsó un flujo de lava de 1.600 metros;https://www.pagina12.com.ar/339092-el-volcan-pacaya-expulso-un-flujo-de-lava-de-1-600-metros
https://www.pagina12.com.ar/secciones/sociedad?page=220;Hubo 92 femicidios y 5 transfemicidios en lo que va de 2021;https://www.pagina12.com.ar/339085-hubo-92-femicidios-y-5-transfemicidios-en-lo-que-va-de-2021
https://www.pagina12.com.ar/secciones/sociedad?page=220;Clima en Buenos Aires: el pronóstico del tiempo para este sábado 1 de mayo;https://www.pagina12.com.ar/339058-clima-en-buenos-aires-el-pronostico-del-tiempo-para-este-sab
https://www.pagina12.com.ar/secciones/sociedad?page=221;Cuándo es el próximo feriado;https://www.pagina12.com.ar/339033-cuando-es-el-proximo-feriado
https://www.pagina12.com.ar/secciones/sociedad?page=221;Efemérides de hoy: qué pasó un 1º de mayo;https://www.pagina12.com.ar/338568-efemerides-de-hoy-que-paso-un-1-de-mayo
https://www.pagina12.com.ar/secciones/sociedad?page=221;Estados Unidos: El debate alrededor de las liberación de las patentes de las vacunas contra el coronavirus;https://www.pagina12.com.ar/339028-estados-unidos-el-debate-alrededor-de-las-liberacion-de-las-
https://www.pagina12.com.ar/secciones/sociedad?page=221;"Diego Maradona recibió un tratamiento ""inadecuado, deficiente y temerario""";https://www.pagina12.com.ar/339027-diego-maradona-recibio-un-tratamiento-inadecuado-deficiente-
https://www.pagina12.com.ar/secciones/sociedad?page=221;Qué estaciones de subte dejan de funcionar por la pandemia;https://www.pagina12.com.ar/339007-que-estaciones-de-subte-dejan-de-funcionar-por-la-pandemia
https://www.pagina12.com.ar/secciones/sociedad?page=221;Coronavirus en Argentina: se registraron 22.420 casos y 357 muertes   ;https://www.pagina12.com.ar/338999-coronavirus-en-argentina-se-registraron-22-420-casos-y-357-m
https://www.pagina12.com.ar/secciones/sociedad?page=221;Un locro solidario para quienes luchan contra el coronavirus en los hospitales ;https://www.pagina12.com.ar/338998-un-locro-solidario-para-quienes-luchan-contra-el-coronavirus
https://www.pagina12.com.ar/secciones/sociedad?page=221;Rusia afirma que la Sputnik V genera inmunidad al menos durante un año;https://www.pagina12.com.ar/338991-rusia-afirma-que-la-sputnik-v-genera-inmunidad-al-menos-dura
https://www.pagina12.com.ar/secciones/sociedad?page=221;Acuerdo entre Nación y Ciudad: los 18 accesos que estarán cerrados;https://www.pagina12.com.ar/338987-acuerdo-entre-nacion-y-ciudad-los-18-accesos-que-estaran-cer
https://www.pagina12.com.ar/secciones/sociedad?page=221;La respuesta de Dyhzy a las agresiones que recibe en redes sociales;https://www.pagina12.com.ar/338975-la-respuesta-de-dyhzy-a-las-agresiones-que-recibe-en-redes-s
https://www.pagina12.com.ar/secciones/sociedad?page=221;Descubrieron la primera momia egipcia de una embarazada;https://www.pagina12.com.ar/338966-descubrieron-la-primera-momia-egipcia-de-una-embarazada
https://www.pagina12.com.ar/secciones/sociedad?page=222;Qué pasa con los permisos de circulación y cómo sacarlo si no lo tenés ;https://www.pagina12.com.ar/338965-que-pasa-con-los-permisos-de-circulacion-y-como-sacarlo-si-n
https://www.pagina12.com.ar/secciones/sociedad?page=222;Coronavirus: qué se sabe de las variantes;https://www.pagina12.com.ar/338835-coronavirus-que-se-sabe-de-las-variantes
https://www.pagina12.com.ar/secciones/sociedad?page=222;Oxígeno: ahora se deberá tramitar un permiso para su exportación;https://www.pagina12.com.ar/338964-oxigeno-ahora-se-debera-tramitar-un-permiso-para-su-exportac
https://www.pagina12.com.ar/secciones/sociedad?page=222;Un sello postal mexicano en homenaje a Astor Piazzolla;https://www.pagina12.com.ar/338911-un-sello-postal-mexicano-en-homenaje-a-astor-piazzolla
https://www.pagina12.com.ar/secciones/sociedad?page=222;Qué feriados hay en mayo;https://www.pagina12.com.ar/338948-que-feriados-hay-en-mayo
https://www.pagina12.com.ar/secciones/sociedad?page=222;Un manual para la salud trans;https://www.pagina12.com.ar/338830-un-manual-para-la-salud-trans
https://www.pagina12.com.ar/secciones/sociedad?page=222;Clima en Buenos Aires: el pronóstico del tiempo para este viernes 30 de abril;https://www.pagina12.com.ar/338937-clima-en-buenos-aires-el-pronostico-del-tiempo-para-este-vie
https://www.pagina12.com.ar/secciones/sociedad?page=222;Efemérides de hoy: qué pasó un 30 de abril;https://www.pagina12.com.ar/338567-efemerides-de-hoy-que-paso-un-30-de-abril
https://www.pagina12.com.ar/secciones/sociedad?page=222;"Cristina Castro: ""Ya sabemos la verdad, creo que falta poco para conseguir justicia""";https://www.pagina12.com.ar/338844-cristina-castro-ya-sabemos-la-verdad-creo-que-falta-poco-par
https://www.pagina12.com.ar/secciones/sociedad?page=222;"""Los invito a que intenten conseguir una cama, digan que pagan en efectivo""";https://www.pagina12.com.ar/338845-los-invito-a-que-intenten-conseguir-una-cama-digan-que-pagan
https://www.pagina12.com.ar/secciones/sociedad?page=222;Catamarca: avanza el juicio contra Juan de Dios Gutiérrez, el cura acusado de abuso sexual ;https://www.pagina12.com.ar/338762-catamarca-avanza-el-juicio-contra-juan-de-dios-gutierrez-el-
https://www.pagina12.com.ar/secciones/sociedad?page=223;Coronavirus: en la Ciudad de Buenos Aires el 60% de los contagiados tiene las variantes del Reino Unido y Manaos;https://www.pagina12.com.ar/338765-coronavirus-en-la-ciudad-de-buenos-aires-el-60-de-los-contag
https://www.pagina12.com.ar/secciones/sociedad?page=223;Un estudio prueba que la consanguinidad es un factor de riesgo para el Alzheimer ;https://www.pagina12.com.ar/338767-un-estudio-prueba-que-la-consanguinidad-es-un-factor-de-ries
https://www.pagina12.com.ar/secciones/sociedad?page=223;"Abusó de su nieta de seis años pero una jueza le dio libertad condicional por su ""buen concepto social""";https://www.pagina12.com.ar/338785-abuso-de-su-nieta-de-seis-anos-pero-una-jueza-le-dio-liberta
https://www.pagina12.com.ar/secciones/sociedad?page=223;Otro episodio de violencia de género en Pilar;https://www.pagina12.com.ar/338817-otro-episodio-de-violencia-de-genero-en-pilar
https://www.pagina12.com.ar/secciones/sociedad?page=223;Rechazaron el sobreseimiento de Pity Álvarez en la causa por homicidio;https://www.pagina12.com.ar/338822-rechazaron-el-sobreseimiento-de-pity-alvarez-en-la-causa-por
https://www.pagina12.com.ar/secciones/sociedad?page=223;Coronavirus en Argentina: se registraron 26.053 casos y 561 muertes  ;https://www.pagina12.com.ar/338796-coronavirus-en-argentina-se-registraron-26-053-casos-y-561-m
https://www.pagina12.com.ar/secciones/sociedad?page=223;El nuevo diseño de Spotify viene con más funciones;https://www.pagina12.com.ar/338792-el-nuevo-diseno-de-spotify-viene-con-mas-funciones
https://www.pagina12.com.ar/secciones/sociedad?page=223;Qué va a pasar con quienes recibieron la primera dosis de la vacuna Covishield;https://www.pagina12.com.ar/338781-que-va-a-pasar-con-quienes-recibieron-la-primera-dosis-de-la
https://www.pagina12.com.ar/secciones/sociedad?page=223;La ANMAT prohibió dos quesos y equipos de depilación;https://www.pagina12.com.ar/338739-la-anmat-prohibio-dos-quesos-y-equipos-de-depilacion
https://www.pagina12.com.ar/secciones/sociedad?page=223;Clima en Buenos Aires: el pronóstico del tiempo para este jueves 29 de abril;https://www.pagina12.com.ar/338737-clima-en-buenos-aires-el-pronostico-del-tiempo-para-este-jue
https://www.pagina12.com.ar/secciones/sociedad?page=223;Efemérides de hoy: qué pasó un 29 de abril ;https://www.pagina12.com.ar/338566-efemerides-de-hoy-que-paso-un-29-de-abril
https://www.pagina12.com.ar/secciones/sociedad?page=224;Violencia de género: presentaron RUDA, el registro bonaerense de acompañamiento para relevar qué sucede en los territorios;https://www.pagina12.com.ar/338641-violencia-de-genero-presentaron-ruda-el-registro-bonaerense-
https://www.pagina12.com.ar/secciones/sociedad?page=224;Los hospitales porteños tienen pronóstico crítico;https://www.pagina12.com.ar/338716-los-hospitales-portenos-tienen-pronostico-critico
https://www.pagina12.com.ar/secciones/sociedad?page=224;"""Techo de cristal"": la insólita respuesta de un aspirante a juez cuando le preguntaron por el concepto";https://www.pagina12.com.ar/338559-techo-de-cristal-la-insolita-respuesta-de-un-aspirante-a-jue
https://www.pagina12.com.ar/secciones/sociedad?page=224;Murió Michael Collins, el astronauta de la primera misión a la Luna que no llegó a pisarla;https://www.pagina12.com.ar/338575-murio-michael-collins-el-astronauta-de-la-primera-mision-a-l
https://www.pagina12.com.ar/secciones/sociedad?page=224;Ni OVNI ni basura espacial, al final el riesgo de choque del SpaceX fue una falsa alarma;https://www.pagina12.com.ar/338580-ni-ovni-ni-basura-espacial-al-final-el-riesgo-de-choque-del-
https://www.pagina12.com.ar/secciones/sociedad?page=224;Coronavirus en Argentina: se registraron 23.718 casos y 348 muertes ;https://www.pagina12.com.ar/338601-coronavirus-en-argentina-se-registraron-23-718-casos-y-348-m
https://www.pagina12.com.ar/secciones/sociedad?page=224;Coronavirus: científicos del Conicet presentan una plataforma para medir linfocitos T  ;https://www.pagina12.com.ar/338604-coronavirus-cientificos-del-conicet-presentan-una-plataforma
https://www.pagina12.com.ar/secciones/sociedad?page=224;Qué es la ELA, la enfermedad que le diagnosticaron a Esteban Bullrich;https://www.pagina12.com.ar/338504-que-es-la-ela-la-enfermedad-que-le-diagnosticaron-a-esteban-
https://www.pagina12.com.ar/secciones/sociedad?page=224;"Vacuna de Pfizer: ""Necesitamos una tercera dosis"", anunció el laboratorio";https://www.pagina12.com.ar/338518-vacuna-de-pfizer-necesitamos-una-tercera-dosis-anuncio-el-la
https://www.pagina12.com.ar/secciones/sociedad?page=224;El río es nuestra identidad;https://www.pagina12.com.ar/338631-el-rio-es-nuestra-identidad
https://www.pagina12.com.ar/secciones/sociedad?page=224;Autorizaron la inscripción de variedades de cannabis para uso medicinal  ;https://www.pagina12.com.ar/338647-autorizaron-la-inscripcion-de-variedades-de-cannabis-para-us
https://www.pagina12.com.ar/secciones/sociedad?page=225;La variante de Manaos podría ser más transmisible y evadir la inmunidad previa;https://www.pagina12.com.ar/338607-la-variante-de-manaos-podria-ser-mas-transmisible-y-evadir-l
https://www.pagina12.com.ar/secciones/sociedad?page=225;Bariloche: restringen la circulación y suspenden las clases presenciales por la segunda ola;https://www.pagina12.com.ar/338569-bariloche-restringen-la-circulacion-y-suspenden-las-clases-p
https://www.pagina12.com.ar/secciones/sociedad?page=225;"El biólogo argentino Carlos Roesler fue nominado a los ""Oscar verdes""";https://www.pagina12.com.ar/338555-el-biologo-argentino-carlos-roesler-fue-nominado-a-los-oscar
https://www.pagina12.com.ar/secciones/sociedad?page=225;Los herederos de Samsung venderán sus Picasso, Monet y Dalí para reducir los impuestos por la sucesión de su padre;https://www.pagina12.com.ar/338551-los-herederos-de-samsung-venderan-sus-picasso-monet-y-dali-p
https://www.pagina12.com.ar/secciones/sociedad?page=225;"La niña ""Disaster Girl"" ganó casi medio millón de dólares por su meme";https://www.pagina12.com.ar/338538-la-nina-disaster-girl-gano-casi-medio-millon-de-dolares-por-
https://www.pagina12.com.ar/secciones/sociedad?page=225;Oxígeno médico: ¿por qué falta en el mundo y cómo se fabrica?;https://www.pagina12.com.ar/338535-oxigeno-medico-por-que-falta-en-el-mundo-y-como-se-fabrica
https://www.pagina12.com.ar/secciones/sociedad?page=225;Pfizer y Astrazeneca: una dosis de las vacunas reduce a casi la mitad la transmisión de coronavirus en el hogar;https://www.pagina12.com.ar/338533-pfizer-y-astrazeneca-una-dosis-de-las-vacunas-reduce-a-casi-
https://www.pagina12.com.ar/secciones/sociedad?page=225;Estudian una nueva variante de coronavirus en Perú: la cepa andina;https://www.pagina12.com.ar/338502-estudian-una-nueva-variante-de-coronavirus-en-peru-la-cepa-a
https://www.pagina12.com.ar/secciones/sociedad?page=225;Clima en Buenos Aires: el pronóstico del tiempo para este miércoles 28 de abril;https://www.pagina12.com.ar/338479-clima-en-buenos-aires-el-pronostico-del-tiempo-para-este-mie
https://www.pagina12.com.ar/secciones/sociedad?page=225;Efemérides de hoy: qué pasó un 28 de abril;https://www.pagina12.com.ar/338476-efemerides-de-hoy-que-paso-un-28-de-abril
https://www.pagina12.com.ar/secciones/sociedad?page=225;Coronavirus en Argentina: se registraron 516 muertes en las últimas 24 horas;https://www.pagina12.com.ar/338341-coronavirus-en-argentina-se-registraron-516-muertes-en-las-u
https://www.pagina12.com.ar/secciones/sociedad?page=226;Coronavirus: Todas las camas de terapia están ocupadas;https://www.pagina12.com.ar/338344-coronavirus-todas-las-camas-de-terapia-estan-ocupadas
https://www.pagina12.com.ar/secciones/sociedad?page=226;Los estudiantes que quieren clases, en forma virtual;https://www.pagina12.com.ar/338354-los-estudiantes-que-quieren-clases-en-forma-virtual
https://www.pagina12.com.ar/secciones/sociedad?page=226;Costa Salguero: la Justicia porteña declaró la inconstitucionalidad de la venta de los terrenos ;https://www.pagina12.com.ar/338406-costa-salguero-la-justicia-portena-declaro-la-inconstitucion
https://www.pagina12.com.ar/secciones/sociedad?page=226;Costa Salguero: reacciones favorables al fallo judicial;https://www.pagina12.com.ar/338419-costa-salguero-reacciones-favorables-al-fallo-judicial
https://www.pagina12.com.ar/secciones/sociedad?page=226;"Mujeres de pueblos originarios: la ""Caminata Basta de Terricidio"" que partió del sur y el norte se acerca a CABA ";https://www.pagina12.com.ar/338269-mujeres-de-pueblos-originarios-la-caminata-basta-de-terricid
https://www.pagina12.com.ar/secciones/sociedad?page=226;Clases presenciales: la fuerte respuesta de Los Auténticos Decadentes sobre la campaña del gobierno porteño con un tema suyo;https://www.pagina12.com.ar/338378-clases-presenciales-la-fuerte-respuesta-de-los-autenticos-de
