pagSeccion;titulo;href
https://www.pagina12.com.ar/secciones/sociedad?page=258;Quiénes pueden usar el transporte público y cómo tramitar el permiso;https://www.pagina12.com.ar/334175-quienes-pueden-usar-el-transporte-publico-y-como-tramitar-el
https://www.pagina12.com.ar/secciones/sociedad?page=259;Abuso sexual: Thelma Fardin detallará avances en la causa contra Juan Darthés;https://www.pagina12.com.ar/334170-abuso-sexual-thelma-fardin-detallara-avances-en-la-causa-con
https://www.pagina12.com.ar/secciones/sociedad?page=259;Respaldo a la vacuna de AstraZeneca de parte de la agencia de control de medicamentos europea;https://www.pagina12.com.ar/334161-respaldo-a-la-vacuna-de-astra-zeneca-de-parte-de-la-agencia-
https://www.pagina12.com.ar/secciones/sociedad?page=259;Coronavirus: qué es un contacto estrecho y qué hacer en caso de serlo;https://www.pagina12.com.ar/334157-coronavirus-que-es-un-contacto-estrecho-y-que-hacer-en-caso-
https://www.pagina12.com.ar/secciones/sociedad?page=259;Una niña de 6 años cayó de un quinto piso en Puerto Madero;https://www.pagina12.com.ar/334136-una-nina-de-6-anos-cayo-de-un-quinto-piso-en-puerto-madero
https://www.pagina12.com.ar/secciones/sociedad?page=259;Clima en Buenos Aires: el pronóstico del tiempo para este miércoles 7 de abril;https://www.pagina12.com.ar/334131-clima-en-buenos-aires-el-pronostico-del-tiempo-para-este-mie
https://www.pagina12.com.ar/secciones/sociedad?page=259;Efemérides de hoy: qué pasó un 7 de abril;https://www.pagina12.com.ar/334012-efemerides-de-hoy-que-paso-un-7-de-abril
https://www.pagina12.com.ar/secciones/sociedad?page=259;El sexo tras un año de pandemia: lo que hace la gente y lo que recomiendan los especialistas;https://www.pagina12.com.ar/333998-el-sexo-tras-un-ano-de-pandemia-lo-que-hace-la-gente-y-lo-qu
https://www.pagina12.com.ar/secciones/sociedad?page=259;Récord de contagios: se registraron 20.870 casos de coronavirus en Argentina;https://www.pagina12.com.ar/334024-record-de-contagios-se-registraron-20-870-casos-de-coronavir
https://www.pagina12.com.ar/secciones/sociedad?page=259;La Comisión Bicameral decidió acusar a los jueces del caso de Lucía Pérez;https://www.pagina12.com.ar/334027-la-comision-bicameral-decidio-acusar-a-los-jueces-del-caso-d
https://www.pagina12.com.ar/secciones/sociedad?page=259;Clausura y denuncia penal;https://www.pagina12.com.ar/334061-clausura-y-denuncia-penal
https://www.pagina12.com.ar/secciones/sociedad?page=259;Pedido de perpetua en el juicio por el femicidio de Viviana Giménez;https://www.pagina12.com.ar/334067-pedido-de-perpetua-en-el-juicio-por-el-femicidio-de-viviana-
https://www.pagina12.com.ar/secciones/sociedad?page=260;Desesperado reclamo por Tehuel de la Torre;https://www.pagina12.com.ar/334071-desesperado-reclamo-por-tehuel-de-la-torre
https://www.pagina12.com.ar/secciones/sociedad?page=260;Las dudas sobre la vacuna de AstraZeneca: un experto la vincula con la trombosis, pero la Agencia Europea dijo que todavía no terminó el estudio;https://www.pagina12.com.ar/333971-las-dudas-sobre-la-vacuna-de-astra-zeneca-un-experto-la-vinc
https://www.pagina12.com.ar/secciones/sociedad?page=260;"La variante de coronavirus ""doble mutante"" fue detectada en Estados Unidos";https://www.pagina12.com.ar/333987-la-variante-de-coronavirus-doble-mutante-fue-detectada-en-es
https://www.pagina12.com.ar/secciones/sociedad?page=260;La policía de Buenos Aires busca a otra mujer desaparecida;https://www.pagina12.com.ar/334028-la-policia-de-buenos-aires-busca-a-otra-mujer-desaparecida
https://www.pagina12.com.ar/secciones/sociedad?page=260;¿Qué es la ventilación cruzada y por qué es efectiva contra el coronavirus?;https://www.pagina12.com.ar/333992-que-es-la-ventilacion-cruzada-y-por-que-es-efectiva-contra-e
https://www.pagina12.com.ar/secciones/sociedad?page=260;Una mujer murió al caer por el hueco de un ascensor en Palermo;https://www.pagina12.com.ar/333970-una-mujer-murio-al-caer-por-el-hueco-de-un-ascensor-en-paler
https://www.pagina12.com.ar/secciones/sociedad?page=260;Clima en Buenos Aires: el pronóstico del tiempo para este 6 de abril;https://www.pagina12.com.ar/333967-clima-en-buenos-aires-el-pronostico-del-tiempo-para-este-6-d
https://www.pagina12.com.ar/secciones/sociedad?page=260;Efemérides de hoy: qué pasó un 6 de abril;https://www.pagina12.com.ar/333517-efemerides-de-hoy-que-paso-un-6-de-abril
https://www.pagina12.com.ar/secciones/sociedad?page=260;Paracetamol: un estudio reveló que es efectivo para muy pocas dolencias;https://www.pagina12.com.ar/333805-paracetamol-un-estudio-revelo-que-es-efectivo-para-muy-pocas
https://www.pagina12.com.ar/secciones/sociedad?page=260;Estados Unidos: más de 40.000 niñes  perdieron a su madre o padre por la pandemia;https://www.pagina12.com.ar/333822-estados-unidos-mas-de-40-000-nines-perdieron-a-su-madre-o-pa
https://www.pagina12.com.ar/secciones/sociedad?page=260;Coronavirus: se registraron 13.667 nuevos contagios y 272 muertos;https://www.pagina12.com.ar/333842-coronavirus-se-registraron-13-667-nuevos-contagios-y-272-mue
https://www.pagina12.com.ar/secciones/sociedad?page=261;Catamarca: suspenden clases presenciales en cuatro departamentos por casos de coronavirus ;https://www.pagina12.com.ar/333868-catamarca-suspenden-clases-presenciales-en-cuatro-departamen
https://www.pagina12.com.ar/secciones/sociedad?page=261;Una turista murió en Bariloche;https://www.pagina12.com.ar/333869-una-turista-murio-en-bariloche
https://www.pagina12.com.ar/secciones/sociedad?page=261;Ley de humedales: la ONU alertó por su conservación en Argentina y llamó a avanzar con la ley;https://www.pagina12.com.ar/333876-ley-de-humedales-la-onu-alerto-por-su-conservacion-en-argent
https://www.pagina12.com.ar/secciones/sociedad?page=261;Ley sobre etiquetado de alimentos: avanza el debate en comisiones de Diputados;https://www.pagina12.com.ar/333887-ley-sobre-etiquetado-de-alimentos-avanza-el-debate-en-comisi
https://www.pagina12.com.ar/secciones/sociedad?page=261;Colegio Nacional Buenos Aires: reclaman que se garantice el ciclo lectivo 2021;https://www.pagina12.com.ar/333892-colegio-nacional-buenos-aires-reclaman-que-se-garantice-el-c
https://www.pagina12.com.ar/secciones/sociedad?page=261;Manada de Chubut: los acusados irán finalmente a juicio oral;https://www.pagina12.com.ar/333908-manada-de-chubut-los-acusados-iran-finalmente-a-juicio-oral
https://www.pagina12.com.ar/secciones/sociedad?page=261;Casación confirmó el procesamiento del joven que, con coronavirus, fue a una fiesta de 100 personas;https://www.pagina12.com.ar/333772-casacion-confirmo-el-procesamiento-del-joven-que-con-coronav
https://www.pagina12.com.ar/secciones/sociedad?page=261;Emergencia ambiental en Florida por un estanque de residuos químicos;https://www.pagina12.com.ar/333782-emergencia-ambiental-en-florida-por-un-estanque-de-residuos-
https://www.pagina12.com.ar/secciones/sociedad?page=261;Coronavirus: Advertencia del infectólogo Eduardo López de mantener los protocolos;https://www.pagina12.com.ar/333791-coronavirus-advertencia-del-infectologo-eduardo-lopez-de-man
https://www.pagina12.com.ar/secciones/sociedad?page=261;Allanaron a Matías Morla, y no podrá hacer uso de las marcas de Diego Maradona;https://www.pagina12.com.ar/333896-allanaron-a-matias-morla-y-no-podra-hacer-uso-de-las-marcas-
https://www.pagina12.com.ar/secciones/sociedad?page=261;Investigan la muerte de una joven durante una excursión en Ushuaia  ;https://www.pagina12.com.ar/333881-investigan-la-muerte-de-una-joven-durante-una-excursion-en-u
https://www.pagina12.com.ar/secciones/sociedad?page=262;Una nueva expulsión de lava en Islandia ;https://www.pagina12.com.ar/333836-una-nueva-expulsion-de-lava-en-islandia
https://www.pagina12.com.ar/secciones/sociedad?page=262;A pesar del conflicto, el Colegio Nacional de Buenos Aires retomó las clases presenciales;https://www.pagina12.com.ar/333794-a-pesar-del-conflicto-el-colegio-nacional-de-buenos-aires-re
https://www.pagina12.com.ar/secciones/sociedad?page=262;La eficacia de las vacunas no es lo único que importa: por qué es un error compararlas;https://www.pagina12.com.ar/333771-la-eficacia-de-las-vacunas-no-es-lo-unico-que-importa-por-qu
https://www.pagina12.com.ar/secciones/sociedad?page=262;"Anmat prohibió dos aceites de girasol y un alimento ""anti-estrés""";https://www.pagina12.com.ar/333764-anmat-prohibio-dos-aceites-de-girasol-y-un-alimento-anti-est
https://www.pagina12.com.ar/secciones/sociedad?page=262;Clima en Buenos Aires: el pronóstico del tiempo para este lunes 5 de abril;https://www.pagina12.com.ar/333753-clima-en-buenos-aires-el-pronostico-del-tiempo-para-este-lun
https://www.pagina12.com.ar/secciones/sociedad?page=262;Efemérides de hoy: qué pasó un 5 de abril;https://www.pagina12.com.ar/333516-efemerides-de-hoy-que-paso-un-5-de-abril
https://www.pagina12.com.ar/secciones/sociedad?page=262;Aseguran que la Sputnik Light reduce a la mitad la infección por coronavirus;https://www.pagina12.com.ar/333629-aseguran-que-la-sputnik-light-reduce-a-la-mitad-la-infeccion
https://www.pagina12.com.ar/secciones/sociedad?page=262;Coronavirus en Argentina: se registraron 9.955 casos y 93 muertes;https://www.pagina12.com.ar/333669-coronavirus-en-argentina-se-registraron-9-955-casos-y-93-mue
https://www.pagina12.com.ar/secciones/sociedad?page=262;El oficialismo porteño rechazó crear un Ministerio de Género;https://www.pagina12.com.ar/333678-el-oficialismo-porteno-rechazo-crear-un-ministerio-de-genero
https://www.pagina12.com.ar/secciones/sociedad?page=262;¿Dónde está Tehuel?;https://www.pagina12.com.ar/333681-donde-esta-tehuel
https://www.pagina12.com.ar/secciones/sociedad?page=262;Femicidio de Viviana Giménez: comienza el juicio a su expareja;https://www.pagina12.com.ar/333687-femicidio-de-viviana-gimenez-comienza-el-juicio-a-su-exparej
https://www.pagina12.com.ar/secciones/sociedad?page=263;Baldosas en homenaje a Lohana Berkins;https://www.pagina12.com.ar/333698-baldosas-en-homenaje-a-lohana-berkins
https://www.pagina12.com.ar/secciones/sociedad?page=263;Darán el veredicto por el crimen del colectivero Leandro Alcaraz;https://www.pagina12.com.ar/333699-daran-el-veredicto-por-el-crimen-del-colectivero-leandro-alc
https://www.pagina12.com.ar/secciones/sociedad?page=263;Impresionante desfile faraónico: momias de reyes y reinas recorrieron El Cairo;https://www.pagina12.com.ar/333520-impresionante-desfile-faraonico-momias-de-reyes-y-reinas-rec
https://www.pagina12.com.ar/secciones/sociedad?page=263;Coronavirus: las variantes de Manaos y del Reino Unido se expanden en el interior del país;https://www.pagina12.com.ar/333702-coronavirus-las-variantes-de-manaos-y-del-reino-unido-se-exp
https://www.pagina12.com.ar/secciones/sociedad?page=263;Coronavirus:  ¿Qué opinan los científicos sobre el aumento de casos y cómo enfrentarlos?;https://www.pagina12.com.ar/333706-coronavirus-que-opinan-los-cientificos-sobre-el-aumento-de-c
https://www.pagina12.com.ar/secciones/sociedad?page=263;Argentina ya recibió más de siete millones de vacunas contra el coronavirus;https://www.pagina12.com.ar/333621-argentina-ya-recibio-mas-de-siete-millones-de-vacunas-contra
https://www.pagina12.com.ar/secciones/sociedad?page=263;Llegó otro vuelo con medio millón de vacunas Sputnik V;https://www.pagina12.com.ar/333625-llego-otro-vuelo-con-medio-millon-de-vacunas-sputnik-v
https://www.pagina12.com.ar/secciones/sociedad?page=263;Cuándo es el próximo feriado;https://www.pagina12.com.ar/333611-cuando-es-el-proximo-feriado
https://www.pagina12.com.ar/secciones/sociedad?page=263;Clima en Buenos Aires: el pronóstico del tiempo para este domingo 4 de abril;https://www.pagina12.com.ar/333606-clima-en-buenos-aires-el-pronostico-del-tiempo-para-este-dom
https://www.pagina12.com.ar/secciones/sociedad?page=263;Efemérides de hoy: qué pasó un 4 de abril;https://www.pagina12.com.ar/332964-efemerides-de-hoy-que-paso-un-4-de-abril
https://www.pagina12.com.ar/secciones/sociedad?page=263;Hay paro en todas las líneas de subte y el Premetro;https://www.pagina12.com.ar/333480-hay-paro-en-todas-las-lineas-de-subte-y-el-premetro
https://www.pagina12.com.ar/secciones/sociedad?page=264;Los fiscales estudian sumar nuevos imputados y agravar la acusación a homicidio con dolo eventual;https://www.pagina12.com.ar/333519-los-fiscales-estudian-sumar-nuevos-imputados-y-agravar-la-ac
https://www.pagina12.com.ar/secciones/sociedad?page=264;La pata económica de la violencia de género;https://www.pagina12.com.ar/333524-la-pata-economica-de-la-violencia-de-genero
https://www.pagina12.com.ar/secciones/sociedad?page=264;Una mirada psicoanalítica sobre quienes eligen no cuidarse en pandemia;https://www.pagina12.com.ar/333531-una-mirada-psicoanalitica-sobre-quienes-eligen-no-cuidarse-e
https://www.pagina12.com.ar/secciones/sociedad?page=264;Hurlingham mejora su sistema de salud;https://www.pagina12.com.ar/333537-hurlingham-mejora-su-sistema-de-salud
https://www.pagina12.com.ar/secciones/sociedad?page=264;Bateria de test y aislamiento se suman al equipaje de los viajeros internacionales ;https://www.pagina12.com.ar/333540-bateria-de-test-y-aislamiento-se-suman-al-equipaje-de-los-vi
https://www.pagina12.com.ar/secciones/sociedad?page=264;Coronavirus en Argentina: se registraron 10.384 casos y 83 muertes;https://www.pagina12.com.ar/333503-coronavirus-en-argentina-se-registraron-10-384-casos-y-83-mu
https://www.pagina12.com.ar/secciones/sociedad?page=264;Las diez preguntas claves sobre las vacunas contra el coronavirus;https://www.pagina12.com.ar/333482-las-diez-preguntas-claves-sobre-las-vacunas-contra-el-corona
https://www.pagina12.com.ar/secciones/sociedad?page=264;Efemérides de hoy: qué pasó un 3 de abril;https://www.pagina12.com.ar/332958-efemerides-de-hoy-que-paso-un-3-de-abril
https://www.pagina12.com.ar/secciones/sociedad?page=264;Clima en Buenos Aires: el pronóstico del tiempo para este sábado 3 de abril;https://www.pagina12.com.ar/333476-clima-en-buenos-aires-el-pronostico-del-tiempo-para-este-sab
https://www.pagina12.com.ar/secciones/sociedad?page=264;Ley de etiquetado de alimentos: las comisiones de Diputados retoman el debate;https://www.pagina12.com.ar/333307-ley-de-etiquetado-de-alimentos-las-comisiones-de-diputados-r
https://www.pagina12.com.ar/secciones/sociedad?page=264;Femicidio de Pilar Riesco: la jueza declaró en rebeldía al novio y ordenó su detención;https://www.pagina12.com.ar/333311-femicidio-de-pilar-riesco-la-jueza-declaro-en-rebeldia-al-no
https://www.pagina12.com.ar/secciones/sociedad?page=265;Hazaña de médicos rusos: hicieron una operación a corazón abierto en medio de un incendio;https://www.pagina12.com.ar/333314-hazana-de-medicos-rusos-hicieron-una-operacion-a-corazon-abi
https://www.pagina12.com.ar/secciones/sociedad?page=265;Día Mundial de Toma de Conciencia sobre el Autismo: una jornada para incluir y romper mitos;https://www.pagina12.com.ar/333326-dia-mundial-de-toma-de-conciencia-sobre-el-autismo-una-jorna
https://www.pagina12.com.ar/secciones/sociedad?page=265;"Rechazan el pedido de jury para la jueza que armó el acróstico ""típico de machirulo"" en una sentencia";https://www.pagina12.com.ar/333222-rechazan-el-pedido-de-jury-para-la-jueza-que-armo-el-acrosti
https://www.pagina12.com.ar/secciones/sociedad?page=265;El trabajo remoto amenaza el futuro de Nueva York;https://www.pagina12.com.ar/333331-el-trabajo-remoto-amenaza-el-futuro-de-nueva-york
https://www.pagina12.com.ar/secciones/sociedad?page=265;Liberado porque el delito es excarcelable;https://www.pagina12.com.ar/333358-liberado-porque-el-delito-es-excarcelable
https://www.pagina12.com.ar/secciones/sociedad?page=265;Coronavirus en Argentina: se registraron 9.902 nuevos casos y 82 muertes;https://www.pagina12.com.ar/333361-coronavirus-en-argentina-se-registraron-9-902-nuevos-casos-y
https://www.pagina12.com.ar/secciones/sociedad?page=265;Coronavirus: las lesiones en la piel también podrían ser un síntoma;https://www.pagina12.com.ar/333258-coronavirus-las-lesiones-en-la-piel-tambien-podrian-ser-un-s
https://www.pagina12.com.ar/secciones/sociedad?page=265;La vacuna de  AstraZeneca, con nuevos interrogantes;https://www.pagina12.com.ar/333373-la-vacuna-de-astra-zeneca-con-nuevos-interrogantes
https://www.pagina12.com.ar/secciones/sociedad?page=265;Piden que el asesino sea juzgado;https://www.pagina12.com.ar/333376-piden-que-el-asesino-sea-juzgado
https://www.pagina12.com.ar/secciones/sociedad?page=265;Circulaban a gran velocidad en un Audi en Lanús y chocaron contra una columna: murieron dos hermanas;https://www.pagina12.com.ar/333292-circulaban-a-gran-velocidad-en-un-audi-en-lanus-y-chocaron-c
https://www.pagina12.com.ar/secciones/sociedad?page=265;Malvinas: Impactantes revelaciones de las torturas a los conscriptos;https://www.pagina12.com.ar/333403-malvinas-impactantes-revelaciones-de-las-torturas-a-los-cons
https://www.pagina12.com.ar/secciones/sociedad?page=266;Murió un empleado del subte por los vagones contaminados con asbesto;https://www.pagina12.com.ar/333415-murio-un-empleado-del-subte-por-los-vagones-contaminados-con
https://www.pagina12.com.ar/secciones/sociedad?page=266;La nave OSIRIS-REx estudiará otra vez el asteroide Bennu;https://www.pagina12.com.ar/333371-la-nave-osiris-r-ex-estudiara-otra-vez-el-asteroide-bennu
https://www.pagina12.com.ar/secciones/sociedad?page=266;Un perro le quitó el micrófono a una periodista cuando transmitía desde la calle;https://www.pagina12.com.ar/333364-un-perro-le-quito-el-microfono-a-una-periodista-cuando-trans
https://www.pagina12.com.ar/secciones/sociedad?page=266;Ya se puede recorrer el Louvre online en 3D y gratis;https://www.pagina12.com.ar/333327-ya-se-puede-recorrer-el-louvre-online-en-3-d-y-gratis
https://www.pagina12.com.ar/secciones/sociedad?page=266;Piden la detención de dos jóvenes por el accidente en Lanús: videos de Instagram los comprometen;https://www.pagina12.com.ar/333322-piden-la-detencion-de-dos-jovenes-por-el-accidente-en-lanus-
https://www.pagina12.com.ar/secciones/sociedad?page=266;Murió Isamu Akasaki, el padre de la luz LED;https://www.pagina12.com.ar/333312-murio-isamu-akasaki-el-padre-de-la-luz-led
https://www.pagina12.com.ar/secciones/sociedad?page=266;Rigen nuevas reglas para la transferencia de autos y motos: qué cambia;https://www.pagina12.com.ar/333302-rigen-nuevas-reglas-para-la-transferencia-de-autos-y-motos-q
https://www.pagina12.com.ar/secciones/sociedad?page=266;Clima en Buenos Aires: el pronóstico del tiempo para este viernes 2 de abril;https://www.pagina12.com.ar/333284-clima-en-buenos-aires-el-pronostico-del-tiempo-para-este-vie
https://www.pagina12.com.ar/secciones/sociedad?page=266;Efemérides de hoy: qué pasó un 2 de abril;https://www.pagina12.com.ar/332956-efemerides-de-hoy-que-paso-un-2-de-abril
https://www.pagina12.com.ar/secciones/sociedad?page=266;"""No haría nada en contra de mi mujer"", declaró el abogado Carrazzone, acusado de femicidio";https://www.pagina12.com.ar/333251-no-haria-nada-en-contra-de-mi-mujer-declaro-el-abogado-carra
https://www.pagina12.com.ar/secciones/sociedad?page=266;España: una falsa convocatoria a vacunarse provocó un caos en Sevilla;https://www.pagina12.com.ar/333249-espana-una-falsa-convocatoria-a-vacunarse-provoco-un-caos-en
https://www.pagina12.com.ar/secciones/sociedad?page=267;Subte: anuncian un paro para el sábado por la muerte de un trabajador;https://www.pagina12.com.ar/333226-subte-anuncian-un-paro-para-el-sabado-por-la-muerte-de-un-tr
https://www.pagina12.com.ar/secciones/sociedad?page=267;Adidas escogió una modelo con vello en las axilas para su nueva campaña;https://www.pagina12.com.ar/333223-adidas-escogio-una-modelo-con-vello-en-las-axilas-para-su-nu
https://www.pagina12.com.ar/secciones/sociedad?page=267;Preocupación por las nuevas olas de coronavirus en el mundo;https://www.pagina12.com.ar/333215-preocupacion-por-las-nuevas-olas-de-coronavirus-en-el-mundo
https://www.pagina12.com.ar/secciones/sociedad?page=267;CABA: casi 90 mil adultos mayores de 70 se anotaron para recibir la vacuna;https://www.pagina12.com.ar/333214-caba-casi-90-mil-adultos-mayores-de-70-se-anotaron-para-reci
https://www.pagina12.com.ar/secciones/sociedad?page=267;Google Maps ahora permite recorrer el interior de centros comerciales ;https://www.pagina12.com.ar/333206-google-maps-ahora-permite-recorrer-el-interior-de-centros-co
https://www.pagina12.com.ar/secciones/sociedad?page=267;Coronavirus en Argentina: se registraron 14.430 nuevos casos y 83 muertes;https://www.pagina12.com.ar/333195-coronavirus-en-argentina-se-registraron-14-430-nuevos-casos-
https://www.pagina12.com.ar/secciones/sociedad?page=267;Rosario: 200 estudiantes de Medicina sin barbijos a orillas del Paraná;https://www.pagina12.com.ar/333194-rosario-200-estudiantes-de-medicina-sin-barbijos-a-orillas-d
https://www.pagina12.com.ar/secciones/sociedad?page=267;Millonarias pérdidas en la comarca andina;https://www.pagina12.com.ar/333189-millonarias-perdidas-en-la-comarca-andina
https://www.pagina12.com.ar/secciones/sociedad?page=267;Procesan con preventiva a Carlos Savanz;https://www.pagina12.com.ar/333188-procesan-con-preventiva-a-carlos-savanz
https://www.pagina12.com.ar/secciones/sociedad?page=267;El padre de Micaela recordó a su hija con un texto de Galeano;https://www.pagina12.com.ar/333180-el-padre-de-micaela-recordo-a-su-hija-con-un-texto-de-galean
https://www.pagina12.com.ar/secciones/sociedad?page=267;Cuáles son las restricciones vigentes en la Ciudad de Buenos Aires  ;https://www.pagina12.com.ar/333175-cuales-son-las-restricciones-vigentes-en-la-ciudad-de-buenos
https://www.pagina12.com.ar/secciones/sociedad?page=268;Los fiscales van a Casación para recusar a la jueza;https://www.pagina12.com.ar/333174-los-fiscales-van-a-casacion-para-recusar-a-la-jueza
https://www.pagina12.com.ar/secciones/sociedad?page=268;Carta de una víctima al Papa pidiendo celeridad en las causas de pedofilia;https://www.pagina12.com.ar/333173-carta-de-una-victima-al-papa-pidiendo-celeridad-en-las-causa
https://www.pagina12.com.ar/secciones/sociedad?page=268;Los algoritmos de las apps de música fallan con el hip-hop y el hard rock;https://www.pagina12.com.ar/333171-los-algoritmos-de-las-apps-de-musica-fallan-con-el-hip-hop-y
https://www.pagina12.com.ar/secciones/sociedad?page=268;Cómo son la Soberana 2 y la Covaxin, las dos nuevas vacunas que podría comprar Argentina;https://www.pagina12.com.ar/333165-como-son-la-soberana-2-y-la-covaxin-las-dos-nuevas-vacunas-q
https://www.pagina12.com.ar/secciones/sociedad?page=268;CABA: aumenta el índice de reproducción del coronavirus en niñes de 0 a 10 años;https://www.pagina12.com.ar/333162-caba-aumenta-el-indice-de-reproduccion-del-coronavirus-en-ni
https://www.pagina12.com.ar/secciones/sociedad?page=268;Apareció un “perro” al lado de la estatua misteriosa de Mar Del Plata;https://www.pagina12.com.ar/333153-aparecio-un-perro-al-lado-de-la-estatua-misteriosa-de-mar-de
https://www.pagina12.com.ar/secciones/sociedad?page=268;Determinan con un modelo matemático en cuánto tiempo se destruyó Pompeya;https://www.pagina12.com.ar/333152-determinan-con-un-modelo-matematico-en-cuanto-tiempo-se-dest
https://www.pagina12.com.ar/secciones/sociedad?page=268;Micaela: convocan a la campaña #MicaPresente en las redes;https://www.pagina12.com.ar/333148-micaela-convocan-a-la-campana-mica-presente-en-las-redes
https://www.pagina12.com.ar/secciones/sociedad?page=268;El volcán Etna volvió a entrar en erupción: impactantes imágenes del cráter;https://www.pagina12.com.ar/333137-el-volcan-etna-volvio-a-entrar-en-erupcion-impactantes-image
https://www.pagina12.com.ar/secciones/sociedad?page=268;Otro peligroso desafío de TikTok: una niña sufrió un coma alcohólico en Chaco;https://www.pagina12.com.ar/333136-otro-peligroso-desafio-de-tik-tok-una-nina-sufrio-un-coma-al
https://www.pagina12.com.ar/secciones/sociedad?page=268;San Juan tembló por un nuevo sismo;https://www.pagina12.com.ar/333133-san-juan-temblo-por-un-nuevo-sismo
https://www.pagina12.com.ar/secciones/sociedad?page=269;Semana Santa: Alta circulación de vehículos hacia la Costa Atlántica;https://www.pagina12.com.ar/333132-semana-santa-alta-circulacion-de-vehiculos-hacia-la-costa-at
https://www.pagina12.com.ar/secciones/sociedad?page=269;Tragedia en Florencio Varela: una nena de 5 años murió aplastada por vigas que cayeron de un tráiler;https://www.pagina12.com.ar/333127-tragedia-en-florencio-varela-una-nena-de-5-anos-murio-aplast
https://www.pagina12.com.ar/secciones/sociedad?page=269;Una nueva iniciativa para proteger a mujeres en situación de vulnerabilidad;https://www.pagina12.com.ar/332970-una-nueva-iniciativa-para-proteger-a-mujeres-en-situacion-de
https://www.pagina12.com.ar/secciones/sociedad?page=269;Descubrieron en la Patagonia a un temible dinosaurio asesino del Cretácico;https://www.pagina12.com.ar/333122-descubrieron-en-la-patagonia-a-un-temible-dinosaurio-asesino
https://www.pagina12.com.ar/secciones/sociedad?page=269;Clima: el pronóstico del tiempo para Semana Santa;https://www.pagina12.com.ar/332636-clima-el-pronostico-del-tiempo-para-semana-santa
https://www.pagina12.com.ar/secciones/sociedad?page=269;Clima en Buenos Aires: el pronóstico del tiempo para este jueves 1 de abril;https://www.pagina12.com.ar/333115-clima-en-buenos-aires-el-pronostico-del-tiempo-para-este-jue
https://www.pagina12.com.ar/secciones/sociedad?page=269;Efemérides de hoy: qué pasó un 1º de abril;https://www.pagina12.com.ar/332723-efemerides-de-hoy-que-paso-un-1-de-abril
https://www.pagina12.com.ar/secciones/sociedad?page=269;Coronavirus en Argentina: se registraron 16.056 nuevos casos y 124 muertes;https://www.pagina12.com.ar/332965-coronavirus-en-argentina-se-registraron-16-056-nuevos-casos-
